"cmdName","Description","Link","Authors","Letter"
"funnelinst","stata module to generate funnel plots for comparing institutional performance","https://econpapers.repec.org/software/bocbocode/s459283.htm","`Ariel Linden`,` David J Spiegelhalter`","F"
"funnelperform","stata module to produce funnel plot for institutional comparison","https://econpapers.repec.org/software/bocbocode/s458442.htm","`Brent McSharry`","F"
"fuzzydid","stata module to estimate fuzzy difference-in-difference designs","https://econpapers.repec.org/software/bocbocode/s458549.htm","`Cl`é`ment de Chaisemartin`,` Xavier D`'`Haultfoeuille`,` Yannick Guyonvarch`","F"
"fvfix","stata module to compute the future value of a series of equal payments (cash flows)","https://econpapers.repec.org/software/bocbocode/s457588.htm","`M`á`ximo Sangi`á`como`","F"
"fview","stata module to find and view a file","https://econpapers.repec.org/software/bocbocode/s447203.htm","`Ben Jann`","F"
"fvprevar","stata module to extend fvrevar generating permanent result variables","https://econpapers.repec.org/software/bocbocode/s457242.htm","`Roger Newson`","F"
"fvregen","stata module to regenerate factor variables in a parmest output dataset","https://econpapers.repec.org/software/bocbocode/s457070.htm","`Roger Newson`","F"
"fvstrip","stata module for removing b/n/o factor variable operators from varlists","https://econpapers.repec.org/software/bocbocode/s459176.htm","`Mark Schaffer`","F"
"fvvar","stata module to compute the future value of a series of payments (cash flows)","https://econpapers.repec.org/software/bocbocode/s457609.htm","`M`á`ximo Sangi`á`como`","F"
"fxbcr","stata module to estimate benefit-cost ratio (bcr)","https://econpapers.repec.org/software/bocbocode/s458178.htm","`Emad Shehata`,` Sahra Mickaiel`","F"
"g538schemes","stata module to provide graphics schemes for http://fivethirtyeight.com","https://econpapers.repec.org/software/bocbocode/s458404.htm","`Daniel Bischof`","G"
"gain","rats procedure to compute and graph the gain and phase of a pair of series","https://econpapers.repec.org/software/bocbocode/rts00071.htm","`Tom Doan`","G"
"gam","stata module for generalised additive models","https://econpapers.repec.org/software/bocbocode/s428701.htm","`Patrick Royston`,` Gareth Ambler`","G"
"gamet","stata module to perform game-theoretic calculations","https://econpapers.repec.org/software/bocbocode/s447201.htm","`Nicola Orsini`,` Debora Rizzuto`,` Nicola Nante`","G"
"gammafit","stata module to fit a two-parameter gamma distribution","https://econpapers.repec.org/software/bocbocode/s435301.htm","`Nicholas Cox`,` Stephen Jenkins`","G"
"gammaparms","rats procedure to compute parameters required for gamma distribution","https://econpapers.repec.org/software/bocbocode/rts00072.htm","`Tom Doan`","G"
"gammasym","stata module to compute the value of the symmetrical gamma function","https://econpapers.repec.org/software/bocbocode/s439002.htm","`Jean`-`Benoit Hardouin`","G"
"garbage_mixl","stata module to perform bayesian garbage class mixed logit model estimation","https://econpapers.repec.org/software/bocbocode/s459313.htm","`Marcel F`.` Jonker`","G"
"garchfore","rats procedure to perform univariate garch forecasting","https://econpapers.repec.org/software/bocbocode/rts00073.htm","`Tom Doan`","G"
"garmankohlhagen","matlab function to evaluate european fx option prices in the garman and kohlhagen (1983) model","https://econpapers.repec.org/software/bocbocode/m430001.htm","`Agnieszka Janek`,` Rafa`ł` Weron`","G"
"gaussgibbs","gauss modules to estimate common models with gibbs sampling","https://econpapers.repec.org/software/bocbocode/g00013.htm","`Kelvin Balcombe`","G"
"gausshermite","rats procedure to generate weights and grid points for gauss-hermite numerical integration","https://econpapers.repec.org/software/bocbocode/rts00074.htm","`Tom Doan`","G"
"gausshermite","stata module to estimate integrals using gauss hermite quadratures","https://econpapers.repec.org/software/bocbocode/s450401.htm","`Jean`-`Benoit Hardouin`","G"
"gb2fit","stata module to fit generalized beta of the second kind distribution by maximum likelihood","https://econpapers.repec.org/software/bocbocode/s456823.htm","`Stephen Jenkins`","G"
"gb2lfit","stata module to fit generalized beta of the second kind distribution by maximum likelihood (log parameter metric)","https://econpapers.repec.org/software/bocbocode/s457897.htm","`Stephen Jenkins`","G"
"gb2reg","stata module to perform regression with a gb2 error term","https://econpapers.repec.org/software/bocbocode/s458223.htm","`Jake Orchard`","G"
"gbgfit","stata module to fit a generalized beta (type 2) distribution to grouped data via ml","https://econpapers.repec.org/software/bocbocode/s457132.htm","`Austin Nichols`","G"
"gby","stata module to subset graphs and calculate in the same output","https://econpapers.repec.org/software/bocbocode/s381401.htm","`Zhiqiang Wang`","G"
"gcause","stata module to perform granger causality tests","https://econpapers.repec.org/software/bocbocode/s428201.htm","`Patrick Joly`","G"
"gciget","stata module to read global competitiveness index data into stata","https://econpapers.repec.org/software/bocbocode/s458488.htm","`Oleg Badunenko`,` Harald Tauchmann`","G"
"gcode","stata module to download google geocode data","https://econpapers.repec.org/software/bocbocode/s457969.htm","`Muhammad Rashid Ansari`","G"
"gconc","stata module to compute generalized measures of concentration","https://econpapers.repec.org/software/bocbocode/s457104.htm","`Stanislav Kolenikov`,` Zurab Sajaia`","G"
"gcrobustvar","stata module to compute a var-based granger-causality test in the presence of instabilities","https://econpapers.repec.org/software/bocbocode/s458809.htm","`Barbara Rossi`,` Yiru Wang`","G"
"gdecomp","stata module to compute decomposition of outcome differentials after nonlinear models","https://econpapers.repec.org/software/bocbocode/s456763.htm","`Tam`á`s Bartus`","G"
"gdsum","stata module to summarize grouped data","https://econpapers.repec.org/software/bocbocode/s457206.htm","`Daniel Klein`","G"
"ge_gravity2","stata module to solve a gravity model within the universal gravity class","https://econpapers.repec.org/software/bocbocode/s459317.htm","`Rodolfo Campos`,` Iliana Reggio`,` Jacopo Timini`","G"
"ge_gravity","stata module to solve a simple general equilibrium one sector armington-ces trade model","https://econpapers.repec.org/software/bocbocode/s458678.htm","`Thomas Zylkin`","G"
"ged","rats module to draw from generalized error distribution","https://econpapers.repec.org/software/bocbocode/r031702.htm","`Tom Doan`","G"
"geekel2d","stata module to estimate the parameters of unidimensional and bidimensional irt models","https://econpapers.repec.org/software/bocbocode/s439004.htm","`Jean`-`Benoit Hardouin`","G"
"geivars","stata module to calculate generalized entropy inequality indices","https://econpapers.repec.org/software/bocbocode/s366001.htm","`Stephen Jenkins`","G"
"gen_tail","stata module to work with indicator observations","https://econpapers.repec.org/software/bocbocode/s444901.htm","`David Kantor`","G"
"genass","stata module to perform genetic case-control association tests","https://econpapers.repec.org/software/bocbocode/s456415.htm","`Neil Shephard`","G"
"gencpr","stata module for users of danish cpr numbers","https://econpapers.repec.org/software/bocbocode/s459383.htm","`Christoffer Scavenius`","G"
"geneigen","stata module to calculate eigenvalues of a real general matrix","https://econpapers.repec.org/software/bocbocode/s419901.htm","`Christopher Baum`","G"
"genfreq","stata module to produce a frequency distribution for a variable","https://econpapers.repec.org/software/bocbocode/s338802.htm","`Nicholas Cox`","G"
"gengroup","stata module to produce groups of individuals","https://econpapers.repec.org/software/bocbocode/s456848.htm","`Jean`-`Benoit Hardouin`","G"
"genhwcci","stata module to calculate hardy-weinberg equilibrium test in case-control studies","https://econpapers.repec.org/software/bocbocode/s437101.htm","`James Cui`","G"
"genicv","stata module to generate interaction between continuous (or dummy) variables","https://econpapers.repec.org/software/bocbocode/s457231.htm","`Daniel Klein`","G"
"genidseq","stata module for generating a numeric sequence to represent long identifiers","https://econpapers.repec.org/software/bocbocode/s458534.htm","`Ariel Linden`","G"
"geninteract","stata module to generate n-way interaction terms","https://econpapers.repec.org/software/bocbocode/s458540.htm","`Chao Wang`","G"
"genqreg","stata module to perform generalized quantile regression","https://econpapers.repec.org/software/bocbocode/s458158.htm","`Matthew Baker`","G"
"genscore","stata module to generate a score","https://econpapers.repec.org/software/bocbocode/s456202.htm","`Jean`-`Benoit Hardouin`","G"
"genspec","stata module to implement a general-to-specific modelling algorithm","https://econpapers.repec.org/software/bocbocode/s457892.htm","`Damian Clarke`","G"
"gensplines","stata module to generate various spline basis functions","https://econpapers.repec.org/software/bocbocode/s459206.htm","`Paul Lambert`","G"
"genstack","stata module to generate twoway stacked charts","https://econpapers.repec.org/software/bocbocode/s457947.htm","`Gregorio Impavido`","G"
"genstest","stata module to perform generalized s tests for models in the generalized method of moments framework","https://econpapers.repec.org/software/bocbocode/s458742.htm","`Zach Flynn`,` Leandro Magnusson`","G"
"gentrun","stata module to generate truncated normal variate","https://econpapers.repec.org/software/bocbocode/s400501.htm","`Hung`-`Jen Wang`","G"
"genvars","stata module to generate covariate patterns","https://econpapers.repec.org/software/bocbocode/s414002.htm","`Jan Brogger`","G"
"geo2xy","stata module to convert latitude and longitude to xy using map projections","https://econpapers.repec.org/software/bocbocode/s457990.htm","`Robert Picard`,` Michael Stepner`","G"
"geochart","stata module to create interactive map web pages from stata data","https://econpapers.repec.org/software/bocbocode/s457640.htm","`Sergiy Radyakin`","G"
"geocircles","stata module to create circles defined by geographic coordinates","https://econpapers.repec.org/software/bocbocode/s457991.htm","`Robert Picard`","G"
"geocode","stata module to geocode data","https://econpapers.repec.org/software/bocbocode/s457450.htm","`Adam Ozimek`,` Daniel Miles`","G"
"geocode_ip","stata module to geocode ip addresses","https://econpapers.repec.org/software/bocbocode/s458333.htm","`Sergio Correia`","G"
"geocodehere","stata module to provide geocoding relying on nokia’s here maps api","https://econpapers.repec.org/software/bocbocode/s458048.htm","`Simon He`ß","G"
"geocodeopen","stata module to geocode addresses using mapquest open geocoding services and open street maps","https://econpapers.repec.org/software/bocbocode/s457733.htm","`Michael Anderson`","G"
"geodist2","stata module to calculate straight line distance between two coordinates","https://econpapers.repec.org/software/bocbocode/s458031.htm","`Muhammad Rashid Ansari`","G"
"geodist","stata module to compute geographical distances","https://econpapers.repec.org/software/bocbocode/s457147.htm","`Robert Picard`","G"
"geoinpoly","stata module to match geographic locations to shapefile polygons","https://econpapers.repec.org/software/bocbocode/s458016.htm","`Robert Picard`","G"
"geonear","stata module to find nearest neighbors using geodetic distances","https://econpapers.repec.org/software/bocbocode/s457146.htm","`Robert Picard`","G"
"geoplot","stata module to draw maps","https://econpapers.repec.org/software/bocbocode/s459211.htm","`Ben Jann`","G"
"georoute","stata module to calculate travel distance and travel time between two addresses or two geographical points","https://econpapers.repec.org/software/bocbocode/s458264.htm","`Sylvain Weber`,` Martin P`é`clat`","G"
"get_pwmse","stata module to execute pwmse-based model evaluation","https://econpapers.repec.org/software/bocbocode/s459308.htm","`Xiaomeng Cui`","G"
"getcensus","stata module to load american community survey data from the u.s. census bureau api into stata","https://econpapers.repec.org/software/bocbocode/s459008.htm","`Claire Zippel`,` Matt Saenz`,` Raheem Chaudhry`,` Vincent Palacios`","G"
"getdata","stata module to import sdmx data from several providers","https://econpapers.repec.org/software/bocbocode/s458093.htm","`Duarte Gon`ç`alves`","G"
"getfilename2","stata program for handling filename specifications","https://econpapers.repec.org/software/bocbocode/s456511.htm","`Jeffrey Arnold`","G"
"getiref","stata module to search and share stata resources and blogs within stata command window","https://econpapers.repec.org/software/bocbocode/s459391.htm","`Yujun Lian`","G"
"getmstatistic","stata module to quantify systematic heterogeneity in meta-analysis","https://econpapers.repec.org/software/bocbocode/s458347.htm","`Lerato Magosi`","G"
"getmxdata","stata module to import mexican economic data","https://econpapers.repec.org/software/bocbocode/s458726.htm","`Miguel Gonzalez`-`Favila`","G"
"getprime","stata module to get the prime number closer to the specified number","https://econpapers.repec.org/software/bocbocode/s458084.htm","`Alfonso S`á`nchez`-`Pe`ñ`alver`","G"
"getregstats","stata module for computing all values in a regression table when only the coefficient and one other statistic is available","https://econpapers.repec.org/software/bocbocode/s458639.htm","`Ariel Linden`","G"
"gets","stata module to implement a general-to-specific modelling algorithm","https://econpapers.repec.org/software/bocbocode/s457705.htm","`Damian Clarke`","G"
"getsymbols","stata module to collect and integrate one or more series from quandl.com, google finance, yahoo finance, and alpha vantage","https://econpapers.repec.org/software/bocbocode/s458421.htm","`Carlos Dorantes`","G"
"gevfit","stata module to module to fit a generalized extreme value distribution by maximum likelihood","https://econpapers.repec.org/software/bocbocode/s456892.htm","`Scott Merryman`,` David Roodman`","G"
"gfields","stata module to calculate decomposition of inequality by source","https://econpapers.repec.org/software/bocbocode/s417004.htm","`Stanislav Kolenikov`","G"
"gformula","stata module to implement the g-computation formula for estimating causal effects in the presence of time-varying confounding or mediation","https://econpapers.repec.org/software/bocbocode/s457204.htm","`Rhian Daniel`","G"
"ggt","stata module to implement geweke, gowrisankaran, and town model quality estimator","https://econpapers.repec.org/software/bocbocode/s458713.htm","`Kelli Marquardt`,` Gautam Gowrisankaran`,` Robert Town`","G"
"ggtax","stata module to identify the most suitable gg family model","https://econpapers.repec.org/software/bocbocode/s457649.htm","`Andres L Gonzalez Rangel`","G"
"ggtaxonomy","stata module to identify the most suitable gg family model","https://econpapers.repec.org/software/bocbocode/s458058.htm","`Usama Bilal`","G"
"ghansen","stata module to perform gregory-hansen test for cointegration with regime shifts","https://econpapers.repec.org/software/bocbocode/s457327.htm","`Jorge P`é`rez P`é`rez`","G"
"ghazal_guzzler","stata module for ghazal guzzling stata users","https://econpapers.repec.org/software/bocbocode/s458856.htm","`Prashansa Srivastava`","G"
"ghistcum","stata module to graph histogram and cumulative distribution","https://econpapers.repec.org/software/bocbocode/s408701.htm","`Christopher Baum`,` Nicholas Cox`","G"
"ghk2","stata module (enhanced mata function) to implement the geweke-hajivassiliou-keane multivariate normal simulator","https://econpapers.repec.org/software/bocbocode/s456939.htm","`David Roodman`","G"
"ghsurv","stata module for the estimation of survival model using repeated cross-sectional data","https://econpapers.repec.org/software/bocbocode/s458760.htm","`Fernando Rios`-`Avila`","G"
"ghxt","stata module to compute panel groupwise heteroscedasticity tests","https://econpapers.repec.org/software/bocbocode/s457385.htm","`Emad Shehata`","G"
"ginidesc","stata module to compute gini index with within- and between-group inequality decomposition","https://econpapers.repec.org/software/bocbocode/s372901.htm","`Roger Aliaga`-`Diaz`,` Silvia Montoya`","G"
"giniinc","stata module for measuring inequality from incomplete income and survival data","https://econpapers.repec.org/software/bocbocode/s458734.htm","`Long Hong`","G"
"ginireg","stata module for gini regression","https://econpapers.repec.org/software/bocbocode/s457958.htm","`Mark Schaffer`","G"
"gintreg","stata module to perform generalized interval regression","https://econpapers.repec.org/software/bocbocode/s458229.htm","`James McDonald`,` Jacob Triplett`","G"
"gipf","stata module to graphically display a log-linear model","https://econpapers.repec.org/software/bocbocode/s444501.htm","`Adrian Mander`","G"
"git","stata module to manage git repositories","https://econpapers.repec.org/software/bocbocode/s457791.htm","`Rodrigo Martell`","G"
"gitee","stata module to install and uninstall stata packages from gitee website","https://econpapers.repec.org/software/bocbocode/s458963.htm","`Kerry Du`","G"
"givgauss2","stata module to estimate generalized two-parameter inverse gaussian regression","https://econpapers.repec.org/software/bocbocode/s456422.htm","`Joseph Hilbe`","G"
"glcurve7","stata module to derive generalised lorenz curve ordinates with unit record data (version 7)","https://econpapers.repec.org/software/bocbocode/s417401.htm","`Philippe Van Kerm`,` Stephen Jenkins`","G"
"glcurve","stata module to derive generalised lorenz curve ordinates","https://econpapers.repec.org/software/bocbocode/s366302.htm","`Stephen Jenkins`,` Philippe Van Kerm`","G"
"glgamma2","stata module to estimate generalized two-parameter log-gamma regression","https://econpapers.repec.org/software/bocbocode/s456420.htm","`Joseph Hilbe`","G"
"gllamm","stata program to fit generalised linear latent and mixed models","https://econpapers.repec.org/software/bocbocode/s401701.htm","`Sophia Rabe`-`Hesketh`","G"
"glmcorr","stata module for correlation measure of predictive power for glms","https://econpapers.repec.org/software/bocbocode/s428101.htm","`Nicholas Cox`","G"
"glmdeco","stata module to compute detailed decomposition of average outcome differentials in generalized linear models","https://econpapers.repec.org/software/bocbocode/s457817.htm","`Boris Kaiser`","G"
"glsdetrend","rats procedure to perform local to unity gls detrending","https://econpapers.repec.org/software/bocbocode/rts00077.htm","`Tom Doan`","G"
"glst","stata module for trend estimation of summarized dose-response data","https://econpapers.repec.org/software/bocbocode/s452001.htm","`Nicola Orsini`,` Rino Bellocco`,` Sander Greenland`","G"
"gmap","stata module to create heatmaps for the web, using java api developed by google","https://econpapers.repec.org/software/bocbocode/s457921.htm","`Thomas Roca`","G"
"gmautofit","rats procedure to perform automated arima model selection (seasonal models)","https://econpapers.repec.org/software/bocbocode/rts00078.htm","`Tom Doan`","G"
"gmci","stata module to calculate geometric means and their confidence intervals","https://econpapers.repec.org/software/bocbocode/s332301.htm","`John Carlin`","G"
"gmemultinomial","stata module to fit multinomial models using generalized maximum entropy","https://econpapers.repec.org/software/bocbocode/s458061.htm","`Paul Corral Rodas`","G"
"gmmcovearn","stata module to compute gmm estimates of the covariance structure of earnings","https://econpapers.repec.org/software/bocbocode/s457161.htm","`Aed`í`n Doris`,` Donal O`'`Neill`,` Olive Sweetman`","G"
"gnbstrat","stata module to estimate generalized negative binomial with endogenous stratification","https://econpapers.repec.org/software/bocbocode/s456413.htm","`Joseph Hilbe`","G"
"gnewbold","rats procedure to perform granger-newbold forecast comparison test","https://econpapers.repec.org/software/bocbocode/rts00079.htm","`Tom Doan`","G"
"gnpoisson","stata module to estimate generalized poisson regression","https://econpapers.repec.org/software/bocbocode/s457328.htm","`Joseph Hilbe`","G"
"goelevation","stata module to compute elevation for latitude and longitude from google","https://econpapers.repec.org/software/bocbocode/s457946.htm","`Chamara Anuranga`,` J`.`V`.` Jayanthan`","G"
"gologit29","stata module to estimate generalized logistic regression models for ordinal dependent variables","https://econpapers.repec.org/software/bocbocode/s457924.htm","`Richard Williams`","G"
"gologit2","stata module to estimate generalized logistic regression models for ordinal dependent variables","https://econpapers.repec.org/software/bocbocode/s453401.htm","`Richard Williams`","G"
"googleplaces","stata module to return search results from google places","https://econpapers.repec.org/software/bocbocode/s458211.htm","`Taylor Crockett`,` Stephen Barnes`,` Chris Schmidt`","G"
"goprobit","stata module to estimate generalized ordered probit models","https://econpapers.repec.org/software/bocbocode/s456603.htm","`Stefan Boes`","G"
"gpfobl","stata module to perform rotation after factor / principal components","https://econpapers.repec.org/software/bocbocode/s432501.htm","`Herve M`.` Caci`","G"
"gph","matlab module to calculate geweke-porter-hudak long memory statistic","https://econpapers.repec.org/software/bocbocode/t850805.htm","`Ludwig Kanzler`","G"
"gph","rats procedure to compute geweke-porter-hudak estimate of fractional differencing","https://econpapers.repec.org/software/bocbocode/rts00080.htm","`Tom Doan`","G"
"gph_seas","rats module to perform fractional integration of seasonally adjusted timeseries","https://econpapers.repec.org/software/bocbocode/r980223.htm","`Christopher Baum`","G"
"gphepssj","stata module to translate stata graph files to.eps as used for the stata journal","https://econpapers.repec.org/software/bocbocode/s427001.htm","`Roger Newson`","G"
"gphrob","rats modules to perform tests for fractional integration of timeseries","https://econpapers.repec.org/software/bocbocode/r792001.htm","`Christopher Baum`,` John Barkoulas`","G"
"gphudak","stata module to estimate long memory in a timeseries","https://econpapers.repec.org/software/bocbocode/s388101.htm","`Christopher Baum`,` Vince Wiggins`","G"
"gprefscode","stata module to report on graphics preferences","https://econpapers.repec.org/software/bocbocode/s420801.htm","`Jan Brogger`","G"
"gpreg","stata module to estimate regressions with two dimensional fixed effects","https://econpapers.repec.org/software/bocbocode/s457048.htm","`Johannes Schmieder`","G"
"gpreset","stata module to reset preferences for a custom graphics scheme to their original values","https://econpapers.repec.org/software/bocbocode/s419801.htm","`Roger Newson`","G"
"gpscore2","stata module to estimate the parameters of the conditional distribution of the treatment via glm","https://econpapers.repec.org/software/bocbocode/s457665.htm","`Marco Ventura`,` Barbara Guardabascio`","G"
"grand2","stata module to compute an estimate of the grand mean/intercept and differences","https://econpapers.repec.org/software/bocbocode/s355201.htm","`Vince Wiggins`","G"
"grand","stata modules to compute grand mean and dummies for differences","https://econpapers.repec.org/software/bocbocode/s333502.htm","`Vince Wiggins`","G"
"graph3d","stata module to draw colored, scalable, rotatable 3d plots","https://econpapers.repec.org/software/bocbocode/s457929.htm","`Davud Rostam`-`Afschar`,` Robin Jessen`","G"
"graphbinary","stata module to plot explanatory variables vs binary outcome","https://econpapers.repec.org/software/bocbocode/s450801.htm","`Adrian Mander`","G"
"graphexportpdf","stata module to produce pdf graphics on non-windows systems","https://econpapers.repec.org/software/bocbocode/s457036.htm","`Gabriel Rossman`","G"
"graphfunctions","stata module providing a suite of programs to support visualization customizations","https://econpapers.repec.org/software/bocbocode/s459379.htm","`Asjad Naqvi`","G"
"graphlog","stata module to convert log files to pdf documents with embedded graphs using latex","https://econpapers.repec.org/software/bocbocode/s457778.htm","`Martin Rune Hansen`","G"
"grby","stata program to draw bar charts for each covariate pattern","https://econpapers.repec.org/software/bocbocode/s434802.htm","`Nicola Orsini`,` Matteo Bottai`","G"
"grc1leg2","stata module to combine multiple graphs with a single common legend","https://econpapers.repec.org/software/bocbocode/s459360.htm","`Mead Over`","G"
"grcomb","stata module to create and combine several single graphs into one","https://econpapers.repec.org/software/bocbocode/s457103.htm","`Alex Gamma`","G"
"grcompare","stata module to make group comparisons in binary regression models","https://econpapers.repec.org/software/bocbocode/s457255.htm","`Jun Xu`","G"
"gregoryhansen","rats procedure to implement gregory-hansen test for cointegration with breaks","https://econpapers.repec.org/software/bocbocode/rts00082.htm","`Tom Doan`","G"
"grep","stata module to search within your datasets for keywords","https://econpapers.repec.org/software/bocbocode/s457002.htm","`Nikos Askitas`","G"
"grexport","stata module to produce a resultset of graph contents","https://econpapers.repec.org/software/bocbocode/s456756.htm","`Lars Kroll`","G"
"grfreq","stata module to plot proportion of one variable by categories of another","https://econpapers.repec.org/software/bocbocode/s412301.htm","`Jan Brogger`","G"
