"cmdName","Description","Link","Authors","Letter"
"_gapport","stata module to calculates seats in party-list proportional representation","https://econpapers.repec.org/software/bocbocode/s457243.htm","`Ulrich Kohler`","_"
"_gclsort","stata module to sort a single variable via egen","https://econpapers.repec.org/software/bocbocode/s424801.htm","`Philippe Van Kerm`","_"
"_gdistinct","stata module providing egen function to count distinct values","https://econpapers.repec.org/software/bocbocode/s459362.htm","`Noah Case`","_"
"_gprod","stata module to extend egen for product of observations","https://econpapers.repec.org/software/bocbocode/s382501.htm","`Philip Ryan`","_"
"_grmedf","stata module to compute row medians with egen","https://econpapers.repec.org/software/bocbocode/s413301.htm","`Stanislav Kolenikov`","_"
"_grndraw","stata module for random number generation from the gb2, singh-maddala, dagum, fisk and pareto distributions","https://econpapers.repec.org/software/bocbocode/s458350.htm","`Philippe Van Kerm`","_"
"_grpos","stata module to identify observations with at least n positive values","https://econpapers.repec.org/software/bocbocode/s396201.htm","`Fred Wolfe`","_"
"_grprod","stata module to extend generate to produce row products","https://econpapers.repec.org/software/bocbocode/s415603.htm","`Philip Ryan`","_"
"_gslope","stata module to compute simple regression slope","https://econpapers.repec.org/software/bocbocode/s372501.htm","`Jeroen Weesie`","_"
"_gsoundex","stata module to implement soundex algorithm","https://econpapers.repec.org/software/bocbocode/s420901.htm","`Michael Blasnik`","_"
"_gstd01","stata modules to standardize a variable","https://econpapers.repec.org/software/bocbocode/s416601.htm","`Stanislav Kolenikov`","_"
"_gvreldif","stata module to compute relative difference between successive observations","https://econpapers.repec.org/software/bocbocode/s457200.htm","`Stanislav Kolenikov`","_"
"_gwmean","stata module to compute optionally weighted means","https://econpapers.repec.org/software/bocbocode/s458928.htm","`Gueorgui Kolev`","_"
"_gwtmean","stata module containing extensions to generate to implement weighted mean","https://econpapers.repec.org/software/bocbocode/s418804.htm","`David Kantor`","_"
"_peers","stata module to allow egen to compute the average characteristics of peers in a given unit (school, firm, etc.) specified by by()","https://econpapers.repec.org/software/bocbocode/s456946.htm","`Amine Ouazad`","_"
"a2reg","stata module to estimate models with two fixed effects","https://econpapers.repec.org/software/bocbocode/s456942.htm","`Amine Ouazad`","A"
"aaniv","stata module to compute unbiased iv regression","https://econpapers.repec.org/software/bocbocode/s458664.htm","`Austin Nichols`","A"
"aaplot","stata module for scatter plot with linear and/or quadratic fit, automatically annotated","https://econpapers.repec.org/software/bocbocode/s457286.htm","`Nicholas Cox`","A"
"ab2022","stata module to provide gradient solver for ahlfeldt & barr (2022): the economics of skyscrapers","https://econpapers.repec.org/software/bocbocode/s459300.htm","`Gabriel Ahlfeldt`","A"
"abar","stata module to perform arellano-bond test for autocorrelation","https://econpapers.repec.org/software/bocbocode/s437501.htm","`David Roodman`","A"
"abg","stata module to implement the alpha-beta-gamma method of distributional analysis","https://econpapers.repec.org/software/bocbocode/s457936a.htm","`Louis Chauvel`","A"
"ablags","rats procedure to generate arellano-bond set of instruments","https://econpapers.repec.org/software/bocbocode/rts00001.htm","`Tom Doan`","A"
"aboutreg","stata module providing tutorial on regression diagnostics","https://econpapers.repec.org/software/bocbocode/s416602.htm","`Stanislav Kolenikov`","A"
"abrs","stata module to provide toolkit for counterfactuals based on a spatial equilibrium framework with heterogenous preferences by ahlfeldt, bald, roth, seidel: “measuring quality of life under spatial frictions""","https://econpapers.repec.org/software/bocbocode/s459302.htm","`Gabriel Ahlfeldt`","A"
"abrsqol","stata module providing quality-of-life solver for ""measuring quality of life under spatial frictions""","https://econpapers.repec.org/software/bocbocode/s459382.htm","`Gabriel Ahlfeldt`,` Fabian Bald`,` Duncan Roth`,` Tobias Seidel`","A"
"absdid","stata module to estimate treatment effect with abadie semiparametric did estimator","https://econpapers.repec.org/software/bocbocode/s458134.htm","`Kenneth Houngbedji`","A"
"acelong","stata module to fit multilevel mixed-effects ace, ae and ade variance decomposition models","https://econpapers.repec.org/software/bocbocode/s458402.htm","`Volker Lang`","A"
"acreg","stata module to perform arbitrary correlation regression","https://econpapers.repec.org/software/bocbocode/s458889.htm","`Fabrizio Colella`,` Rafael Lalive`,` Seyhun Sakalli`,` Mathias Thoenig`","A"
"actest","gauss module to apply asymmetric causality tests","https://econpapers.repec.org/software/bocbocode/g00014.htm","`Abdulnasser Hatemi`-`J`","A"
"actest","stata module to perform cumby-huizinga general test for autocorrelation in time series","https://econpapers.repec.org/software/bocbocode/s457668.htm","`Christopher Baum`,` Mark Schaffer`","A"
"addbefore","stata module to add number or character before a variable","https://econpapers.repec.org/software/bocbocode/s458425.htm","`Haitao Si`,` Yuan Xue`,` Muhammad Usman`","A"
"addinby","stata module to add in data from a disk dataset using a foreign key","https://econpapers.repec.org/software/bocbocode/s456931.htm","`Roger Newson`","A"
"addnotes","stata program to add notes to the end of text files","https://econpapers.repec.org/software/bocbocode/s456510.htm","`Jeffrey Arnold`","A"
"addplot","stata module to add twoway plot objects to an existing twoway graph","https://econpapers.repec.org/software/bocbocode/s457917.htm","`Ben Jann`","A"
"addtex","stata module to display text on a graph","https://econpapers.repec.org/software/bocbocode/s345901.htm","`Guy D`.`  van Melle`","A"
"addtxt","stata module to add text to graphs","https://econpapers.repec.org/software/bocbocode/s415503.htm","`Gary Longton`","A"
"adecomp","stata module to estimate shapley decomposition by components of a welfare measure","https://econpapers.repec.org/software/bocbocode/s457562.htm","`Jo`ã`o Pedro Azevedo`,` Minh Nguyen`,` Viviane Sanfelice`","A"
"adfautoselect","rats procedure to select optimal lag length to be used for an adf test","https://econpapers.repec.org/software/bocbocode/rts00003.htm","`Tom Doan`","A"
"adfmaxur","stata module to calculate leybourne (1995) adfmax unit root test statistic along with 1, 5 and 10% finite-sample critical values and associated p-values","https://econpapers.repec.org/software/bocbocode/s458330.htm","`Jesus Otero`,` Christopher Baum`","A"
"adfreg","matlab module to calculate augmented dickey-fuller regression","https://econpapers.repec.org/software/bocbocode/t871801.htm","`Ludwig Kanzler`","A"
"adftest","stata module to perform adf and breusch-godfrey tests","https://econpapers.repec.org/software/bocbocode/s458669.htm","`Rafal Wozniak`","A"
"adjacent","stata module to list adjacent values of variables","https://econpapers.repec.org/software/bocbocode/s439601.htm","`Nicholas Cox`","A"
"adjksm","stata module to perform adjusted ""ksm"" for robust scatterplot smoothing","https://econpapers.repec.org/software/bocbocode/s427301.htm","`Isa`í`as Salgado`-`Ugarte`,` Makoto Shimizu`","A"
"adjmean","stata module to calculate variables' means adjusted for covariates","https://econpapers.repec.org/software/bocbocode/s344803.htm","`Joanne M`.` Garrett`","A"
"adjprop","stata module to calculate adjusted probabilities from logistic regression estimates","https://econpapers.repec.org/software/bocbocode/s344804.htm","`Joanne M`.` Garrett`","A"
"adjust","stata module (corrected) to compute adjusted predictions and probabilities after estimation","https://econpapers.repec.org/software/bocbocode/s355001.htm","`Kenneth Higbee`","A"
"admetan","stata module to provide comprehensive meta-analysis","https://econpapers.repec.org/software/bocbocode/s458561.htm","`David Fisher`","A"
"adodev","stata module to reorder ado-path for developers and other independent-minded users","https://econpapers.repec.org/software/bocbocode/s457025.htm","`Roger Newson`","A"
"adodown","stata module making stata packages easier to develop and document using modern tools","https://econpapers.repec.org/software/bocbocode/s459309.htm","`Team Lsms`","A"
"adoedit","stata module to edit ado file in stata's do-file editor","https://econpapers.repec.org/software/bocbocode/s430401.htm","`Dan Blanchette`","A"
"adoinstall","stata module to install stata packages in a specified path","https://econpapers.repec.org/software/bocbocode/s459024.htm","`Gustavo Igl`é`sias`","A"
"adolist","stata module to manage lists of ado packages","https://econpapers.repec.org/software/bocbocode/s456801.htm","`Ben Jann`,` Stefan Wehrli`","A"
"adostore","stata module to store and restore the current ado-path","https://econpapers.repec.org/software/bocbocode/s458427.htm","`Roger Newson`","A"
"adotype","stata module to type ado file","https://econpapers.repec.org/software/bocbocode/s400101.htm","`Nicholas Cox`","A"
"adtest","rats procedure to perform anderson-darling test for normality","https://econpapers.repec.org/software/bocbocode/rts00004.htm","`Tom Doan`","A"
"aedot","stata module to produce dot plot for adverse event data","https://econpapers.repec.org/software/bocbocode/s458735.htm","`Rachel Phillips`,` Suzie Cro`","A"
"aefdr","stata module to perform false discovery rate p-value adjustment for adverse event data","https://econpapers.repec.org/software/bocbocode/s458733.htm","`Rachel Phillips`,` Suzie Cro`","A"
"aevolcano","stata module to produce volcano plot for adverse event data","https://econpapers.repec.org/software/bocbocode/s458736.htm","`Rachel Phillips`,` Suzie Cro`","A"
"aextlogit","stata module to compute average elasticities for fixed effects logit","https://econpapers.repec.org/software/bocbocode/s458254.htm","`Jo`ã`o Santos Silva`","A"
"affiliationexposure","stata module to compute an affiliation exposure model using two-mode actor(row)-by-event(column) network data","https://econpapers.repec.org/software/bocbocode/s457292.htm","`Kayo Fujimoto`","A"
"aformat","stata module to condense the display format of a variable","https://econpapers.repec.org/software/bocbocode/s418802.htm","`Jens Lauritsen`,` John Luke Gallup`","A"
"agfractd","rats procedure to compute andrews-guggenberger estimate of fractional difference","https://econpapers.repec.org/software/bocbocode/rts00005.htm","`Tom Doan`","A"
"aggind","stata module to aggregate indicators among units within a specified radius","https://econpapers.repec.org/software/bocbocode/s458391.htm","`Andreas Hartung`","A"
"agrm","stata module to calculate van der eijk's measure of agreement ""a""","https://econpapers.repec.org/software/bocbocode/s457287.htm","`Alejandro Ecker`","A"
"aic_model_selection","stata module to perform forward model selection using aic or bic","https://econpapers.repec.org/software/bocbocode/s458994.htm","`Matthias Schonlau`","A"
"ainequal","stata module to compute measures of inequality","https://econpapers.repec.org/software/bocbocode/s456748.htm","`Jo`ã`o Pedro Azevedo`","A"
"airnet","stata module to create networks from airline traffic data","https://econpapers.repec.org/software/bocbocode/s457487.htm","`Zachary Neal`","A"
"akdensity","stata module to perform adaptive kernel density estimation","https://econpapers.repec.org/software/bocbocode/s456101.htm","`Philippe Van Kerm`","A"
"albatross","stata module to create albatross plots","https://econpapers.repec.org/software/bocbocode/s458296.htm","`Sean Harrison`","A"
"alignedpairs","stata module to perform the aligned ranks test for matched pairs (hodges-lehmann)","https://econpapers.repec.org/software/bocbocode/s457916.htm","`Ariel Linden`","A"
"alignedranks","stata module to perform a two-sample aligned rank-sum (hodges-lehmann) test with exact statistics for small samples","https://econpapers.repec.org/software/bocbocode/s457871.htm","`Ariel Linden`","A"
"alignedsets","stata module to perform aligned ranks test for matched sets (hodges-lehmann)","https://econpapers.repec.org/software/bocbocode/s457899.htm","`Ariel Linden`","A"
"alignmicro","stata module to perform alignment in microsimulation","https://econpapers.repec.org/software/bocbocode/s457855.htm","`Jinjing Li`","A"
"allcatplot","stata module to ensure that all predefined response categories for a variable, including those that are not present in the dataset are included in a graph","https://econpapers.repec.org/software/bocbocode/s459328.htm","`Kabira Namit`,` Zaeen  de Souza`,` Prabhmeet Kaur Matta`","A"
"allpossible","stata module to fit all possible models with subsets of predictors","https://econpapers.repec.org/software/bocbocode/s427901.htm","`Nicholas Cox`","A"
"allsubsets","stata module to perform all subsets (combinatorial) meta-analysis in a set of studies","https://econpapers.repec.org/software/bocbocode/s457535.htm","`Thomas A`.` Trikalinos`","A"
"allsynth","stata module to automate estimation of (i) bias-corrected synthetic control gaps (""treatment effects"")","https://econpapers.repec.org/software/bocbocode/s459076.htm","`Justin Wiltshire`","A"
"alluvial","stata module for alluvial graphs","https://econpapers.repec.org/software/bocbocode/s459153.htm","`Asjad Naqvi`","A"
"almon1","stata module to estimate shirley almon polynomial distributed lag model","https://econpapers.repec.org/software/bocbocode/s458025.htm","`Emad Shehata`","A"
"almon","stata module to estimate shirley almon generalized polynomial distributed lag model","https://econpapers.repec.org/software/bocbocode/s458126.htm","`Emad Shehata`","A"
"alogit","stata module to estimate (in)attentive logit regression from abaluck and adams","https://econpapers.repec.org/software/bocbocode/s458341.htm","`Jason Abaluck`,` Mauricio Caceres Bravo`","A"
"alorenz","stata module to produce pen's parade, lorenz and generalised lorenz curve","https://econpapers.repec.org/software/bocbocode/s456749.htm","`Jo`ã`o Pedro Azevedo`,` Samuel Franco`","A"
"alphawgt","stata module to compute cronbach's alpha for weighted data","https://econpapers.repec.org/software/bocbocode/s444101.htm","`Ben Jann`","A"
"alsmle","stata module to perform beach-mackinnon ar(1) autoregressive maximum likelihood estimation","https://econpapers.repec.org/software/bocbocode/s457425.htm","`Emad Shehata`","A"
"amcmc","stata module to provide mata functions and structures for adaptive markov chain monte carlo sampling","https://econpapers.repec.org/software/bocbocode/s457613.htm","`Matthew Baker`","A"
"ameta","stata module to perform alternative and bayesian meta-analysis","https://econpapers.repec.org/software/bocbocode/s459051.htm","`Kalliopi K`.` Exarchou`-`Kouveli`,` Eleni Nikolaidou`,` Panagiota I`.` Kontou`,` Pantelis G`.` Bagos`","A"
"anketest","stata module to perform diagnostic tests for spatial autocorrelation in the residuals of ols, sar, iv, and iv-sar models","https://econpapers.repec.org/software/bocbocode/s457113.htm","`P`.` Wilner Jeanty`","A"
"anneal","ox module to perform simulated annealing","https://econpapers.repec.org/software/bocbocode/x942601.htm","`Michael Creel`","A"
"annearly","matlab function to forecast univariate time series","https://econpapers.repec.org/software/bocbocode/t741514.htm","`Shapour Mohammadi`","A"
"anninptsigtest","matlab function to test the statistical significance of inputs","https://econpapers.repec.org/software/bocbocode/t741519.htm","`Shapour Mohammadi`","A"
"annlyap","matlab function to calculate lyapunov exponents","https://econpapers.repec.org/software/bocbocode/t741512.htm","`Shapour Mohammadi`","A"
"annnonlintst","matlab function to perform nonlinearity test for univariate and multivariate time series","https://econpapers.repec.org/software/bocbocode/t741517.htm","`Shapour Mohammadi`","A"
"anogi","stata module to generate analysis of gini","https://econpapers.repec.org/software/bocbocode/s456730.htm","`Ben Jann`","A"
"anymatch","stata module to perform distance matching based on any metric","https://econpapers.repec.org/software/bocbocode/s457077.htm","`Roy Wada`","A"
"anythingtodate","stata module to convert all types of date variables to stata date variables","https://econpapers.repec.org/software/bocbocode/s458725.htm","`Nobuaki Michihata`","A"
"apbreaktest","rats procedure to implement andrews-ploberger structural break test","https://econpapers.repec.org/software/bocbocode/rts00006.htm","`Tom Doan`","A"
"apc","stata module for estimating age-period-cohort effects","https://econpapers.repec.org/software/bocbocode/s456754.htm","`Sam Schulhofer`-`Wohl`,` Yang Yang`","A"
"apcd","stata module for estimating age-period-cohort effects with detrended coefficients","https://econpapers.repec.org/software/bocbocode/s457440.htm","`Louis Chauvel`","A"
"apcgo","stata module to calculate age-period-cohort effects for the gap between two groups (based on a blinder-oaxaca decomposition), including trends for each parameter","https://econpapers.repec.org/software/bocbocode/s458331.htm","`Louis Chauvel`,` Anne Hartung`,` Eyal Bar`-`Haim`","A"
"apch","stata module for estimating age-period-cohort and hysteresis effects","https://econpapers.repec.org/software/bocbocode/s457360.htm","`Louis Chauvel`","A"
"apgradienttest","rats procedure to perform andrews-ploberger structural break test for garch/maximum likelihood","https://econpapers.repec.org/software/bocbocode/rts00007.htm","`Tom Doan`","A"
"apoverty","stata module to compute poverty measures","https://econpapers.repec.org/software/bocbocode/s456750.htm","`Jo`ã`o Pedro Azevedo`","A"
"appendfile","stata module to append text files","https://econpapers.repec.org/software/bocbocode/s456971.htm","`Julian Reif`","A"
"arautolags","rats procedure to compute information criteria for ar models using yule-walker or burg","https://econpapers.repec.org/software/bocbocode/rts00008.htm","`Tom Doan`","A"
"arch","matlab function to compute arch test","https://econpapers.repec.org/software/bocbocode/t961402.htm","`Christopher Baum`","A"
"archlm","stata module to calculate lm test for arch effects","https://econpapers.repec.org/software/bocbocode/s388001.htm","`Christopher Baum`,` Vince Wiggins`","A"
"archqq","stata module to generate q-q plot and distribution tests for arch models","https://econpapers.repec.org/software/bocbocode/s456922.htm","`Sune Karlsson`","A"
"archtest","matlab module to calculate test for autoregressive conditional heteroskedasticity","https://econpapers.repec.org/software/bocbocode/t871802.htm","`Ludwig Kanzler`","A"
"archtest","rats procedure to test a series for arch effects","https://econpapers.repec.org/software/bocbocode/rts00009.htm","`Tom Doan`","A"
"arcplot","stata module for arc plots","https://econpapers.repec.org/software/bocbocode/s459119.htm","`Asjad Naqvi`","A"
"ardl","stata module to perform autoregressive distributed lag model estimation","https://econpapers.repec.org/software/bocbocode/s458528.htm","`Sebastian Kripfganz`,` Daniel C`.` Schneider`","A"
"arfimafc","rats modules to forecast fractionally differenced timeseries","https://econpapers.repec.org/software/bocbocode/r022701.htm","`Christopher Baum`,` John Barkoulas`","A"
"arfsim","rats module to simulate arfima(0,d,0) fractionally integrated series","https://econpapers.repec.org/software/bocbocode/r940902.htm","`Rob Schoen`","A"
"arhomme","stata module to estimate arellano and bonhomme quantile selection model","https://econpapers.repec.org/software/bocbocode/s458890.htm","`Martin Biewen`,` Pascal Erhardt`","A"
"arimaauto","stata module to find the best arima model with the help of a stata-adjusted hyndman-khandakar (2008) algorithm","https://econpapers.repec.org/software/bocbocode/s459043.htm","`Ilya Bolotov`","A"
"arimafit","stata module to calculate aic, sic for arima model","https://econpapers.repec.org/software/bocbocode/s386601.htm","`Christopher Baum`","A"
"arimasel","stata module to compute selection criteria for arma(p,q) models","https://econpapers.repec.org/software/bocbocode/s458840.htm","`Christopher Baum`","A"
"armadiag","stata module to compute post-estimation residual diagnostics for time series","https://econpapers.repec.org/software/bocbocode/s456923.htm","`Sune Karlsson`","A"
"armadlm","rats procedure to set up a dlm (state-space model) based upon an arma model","https://econpapers.repec.org/software/bocbocode/rts00010.htm","`Tom Doan`","A"
"armaroots","stata module to compute roots of ar- and ma-polynomials","https://econpapers.repec.org/software/bocbocode/s456924.htm","`Sune Karlsson`","A"
"armaspectrum","rats procedure to graph the spectral density for an input arma model","https://econpapers.repec.org/software/bocbocode/rts00011.htm","`Tom Doan`","A"
"array","stata package to support arrays of variables","https://econpapers.repec.org/software/bocbocode/s346503.htm","`David E`.` Moore`","A"
"arrowplot","stata module to produce combined plot for graphing inter-group and intra-group trends","https://econpapers.repec.org/software/bocbocode/s457893.htm","`Damian Clarke`","A"
"art","stata module to compute sample size and power for complex randomised trial designs with binary or time-to-event outcomes","https://econpapers.repec.org/software/bocbocode/s458117.htm","`Abdel Babiker`,` Friederike Maria`-`Sophie Barthel`,` Babak Choodari`-`Oskooei`,` Patrick Royston`,` Ella Marley`-`Zagar`,` Ian White`","A"
"artbin","stata module to calculate sample size or power for randomized trials with binary outcomes","https://econpapers.repec.org/software/bocbocode/s459282.htm","`Abdel Babiker`,` Friederike Maria`-`Sophie Barthel`,` Babak Choodari`-`Oskooei`,` Patrick Royston`,` Ella Marley`-`Zagar`,` Ian White`","A"
"artcat","stata module to calculate sample size or power for a two-group trial with ordered categorical outcome","https://econpapers.repec.org/software/bocbocode/s459259.htm","`Ian R`.` White`,` Ella Marley`-`Zagar`,` Tim P`.` Morris`,` Mahesh K`.` B`.` Parmar`,` Patrick Royston`,` Abdel G`.` Babiker`","A"
"ascii","stata module to display the ascii character set","https://econpapers.repec.org/software/bocbocode/s456783.htm","`Adrian Mander`","A"
"asciiplot","stata module to generate ascii character map","https://econpapers.repec.org/software/bocbocode/s456809.htm","`Michael Blasnik`,` Svend Juul`,` Nicholas Cox`","A"
"ascol","stata module to convert frequency of stock returns or stock prices","https://econpapers.repec.org/software/bocbocode/s458082.htm","`Attaullah Shah`","A"
"ascomp","gauss module to transform data into cumulative positive and negative components","https://econpapers.repec.org/software/bocbocode/g00015.htm","`Abdulnasser Hatemi`-`J`","A"
"ascvd","stata module to compute acc/aha 10-year risk for an initial hard atherosclerotic cardiovascular disease (ascvd) event","https://econpapers.repec.org/software/bocbocode/s459162.htm","`Ariel Linden`","A"
"asdoc","stata module to create high-quality tables in ms word from stata output","https://econpapers.repec.org/software/bocbocode/s458466.htm","`Attaullah Shah`","A"
"asgen","stata module to generate weighted average mean using an existing variable as weight","https://econpapers.repec.org/software/bocbocode/s458409.htm","`Attaullah Shah`","A"
"ashell","stata module to capture output from os shell command","https://econpapers.repec.org/software/bocbocode/s456833.htm","`Nikos Askitas`","A"
"asl_norm","stata module computing bootstrap gaussianity tests","https://econpapers.repec.org/software/bocbocode/s457648.htm","`Maarten Buis`","A"
"asreg","stata module to estimate rolling window regressions, fama-macbeth and by(group) regressions","https://econpapers.repec.org/software/bocbocode/s458339.htm","`Attaullah Shah`","A"
"asrol","stata module to generate rolling window / groups descriptive statistics","https://econpapers.repec.org/software/bocbocode/s458075.htm","`Attaullah Shah`","A"
"assertky","stata module to assert unique dataset keys","https://econpapers.repec.org/software/bocbocode/s456785.htm","`David Kantor`","A"
"astile","stata module to provide a faster and byable alternative for xtile","https://econpapers.repec.org/software/bocbocode/s458321.htm","`Attaullah Shah`","A"
"astx","stata module to create a table of descriptive statistics and t-statistics by a grouping variable","https://econpapers.repec.org/software/bocbocode/s458338.htm","`Attaullah Shah`","A"
"asym_caus","c++ module for transforming an integrated variable with deterministic trend parts into negative and positive cumulative partial sums","https://econpapers.repec.org/software/bocbocode/cpp001.htm","`Youssef El`-`Khatib`,` Abdulnasser Hatemi`-`J`","A"
"atkplot","stata module to generate atkinson residual normality plots","https://econpapers.repec.org/software/bocbocode/s414901.htm","`Stanislav Kolenikov`","A"
"attregtest","stata module to implement the regression-based attrition tests proposed in ghanem et al. (2022)","https://econpapers.repec.org/software/bocbocode/s459125.htm","`Dalia Ghanem`,` Sarojini Hirshleifer`,` Karen Ortiz`-`Becerra`","A"
"audit_cc","stata module for analysis of matched case-control audits of cervical cancer screening","https://econpapers.repec.org/software/bocbocode/s459188.htm","`Milena Falcaro`","A"
"autofill","stata module to fill missing values with existing values","https://econpapers.repec.org/software/bocbocode/s458997.htm","`Xia P`.`S`.","A"
"autofmt","stata module to automatically format a significant number of digits","https://econpapers.repec.org/software/bocbocode/s457082.htm","`Roy Wada`","A"
