"cmdName","Description","Link","Authors","Letter"
"rnd","stata modules for random number generation","https://econpapers.repec.org/software/bocbocode/s411501.htm","`Joseph Hilbe`","R"
"robbox","stata module to compute generalized box plots","https://econpapers.repec.org/software/bocbocode/s458620.htm","`Ben Jann`,` Vincenzo Verardi`,` Catherine Vermandele`","R"
"robinson","stata module to compute robinson's coefficient of agreement","https://econpapers.repec.org/software/bocbocode/s459215.htm","`Ariel Linden`","R"
"robit","stata module to estimate robit regression for binary outcomes","https://econpapers.repec.org/software/bocbocode/s459028.htm","`Roger Newson`,` Milena Falcaro`","R"
"roblgt","rats module to estimate binomial logit robustly","https://econpapers.repec.org/software/bocbocode/r951102.htm","`Eric Blankmeyer`","R"
"roblpr","stata module to estimate long memory in a set of timeseries","https://econpapers.repec.org/software/bocbocode/s411001.htm","`Christopher Baum`,` Vince Wiggins`","R"
"robmv","stata module for robust multivariate estimation of location and covariance","https://econpapers.repec.org/software/bocbocode/s458895.htm","`Ben Jann`,` Vincenzo Verardi`,` Catherine Vermandele`","R"
"robnova","stata module to calculate two robust anova statistics, welch's and brown-forsythe's","https://econpapers.repec.org/software/bocbocode/s459140.htm","`David Speed`","R"
"robpc","rats module to compute robust correlation matrix","https://econpapers.repec.org/software/bocbocode/r141105.htm","`Eric Blankmeyer`","R"
"robreg10","stata module providing robust regression estimators","https://econpapers.repec.org/software/bocbocode/s457114.htm","`Ben Jann`","R"
"robreg","rats module to estimate regression robustly and reliably","https://econpapers.repec.org/software/bocbocode/r141104.htm","`Eric Blankmeyer`","R"
"robreg","stata module providing robust regression estimators","https://econpapers.repec.org/software/bocbocode/s458931.htm","`Ben Jann`","R"
"robscale","rats module to compute robust alternative to standard deviation","https://econpapers.repec.org/software/bocbocode/r932501.htm","`Eric Blankmeyer`","R"
"robskew","rats module for computation of quartile skewness measure","https://econpapers.repec.org/software/bocbocode/r141103.htm","`Eric Blankmeyer`","R"
"robstat","stata module to compute robust univariate statistics","https://econpapers.repec.org/software/bocbocode/s458524.htm","`Ben Jann`,` Vincenzo Verardi`,` Catherine Vermandele`","R"
"robumeta","stata module to perform robust variance estimation in meta-regression with dependent effect size estimates","https://econpapers.repec.org/software/bocbocode/s457219.htm","`Eric Hedberg`","R"
"robustate","stata module for estimation and inference for the average treatment effect (ate) robustly against the limited overlap","https://econpapers.repec.org/software/bocbocode/s458930.htm","`Yuya Sasaki`,` Takuya Ura`","R"
"robustlmtest","rats procedure to perform robust lm test for orthogonality of residuals and input series","https://econpapers.repec.org/software/bocbocode/rts00187.htm","`Tom Doan`","R"
"robustpf","stata module for robust estimation of production functions with errors in proxy variables","https://econpapers.repec.org/software/bocbocode/s458792.htm","`Yingyao Hu`,` Guofang Huang`,` Yuya Sasaki`","R"
"rocmic","stata module to estimate minimally important change (mic) thresholds for continuous clinical outcome measures using roc curves","https://econpapers.repec.org/software/bocbocode/s457052.htm","`Robert Froud`","R"
"rocss","stata module to calculate roc curve and other statistics for any classification method","https://econpapers.repec.org/software/bocbocode/s438101.htm","`Nicola Orsini`,` Matteo Bottai`","R"
"roctabi","stata module for performing nonparametric roc analysis using summarized data","https://econpapers.repec.org/software/bocbocode/s458131.htm","`Ariel Linden`","R"
"rolling2","stata module to perform rolling window and recursive estimation","https://econpapers.repec.org/software/bocbocode/s456789.htm","`Christopher Baum`","R"
"rolling3","stata module to compute predicted values for rolling regressions","https://econpapers.repec.org/software/bocbocode/s458159.htm","`Muhammad Rashid Ansari`","R"
"rollreg","rats module to perform rolling and moving-window regressions","https://econpapers.repec.org/software/bocbocode/r852701.htm","`Simon van Norden`","R"
"rollreg","rats procedure to compute rolling regressions for least squares","https://econpapers.repec.org/software/bocbocode/rts00188.htm","`Tom Doan`","R"
"rollreg","stata module to perform rolling regression estimation","https://econpapers.repec.org/software/bocbocode/s444301.htm","`Christopher Baum`","R"
"rollstat","stata module to compute rolling-window statistics for time series or panel data","https://econpapers.repec.org/software/bocbocode/s457582.htm","`M`á`ximo Sangi`á`como`,` Demian Panigo`","R"
"roman","stata module for handling roman numerals and decimal equivalents","https://econpapers.repec.org/software/bocbocode/s457222.htm","`Nicholas Cox`","R"
"romantoarabic","stata module for converting roman numerals to arabic numbers","https://econpapers.repec.org/software/bocbocode/s457216.htm","`Nicholas Cox`","R"
"rori","stata module for estimation of selection bias through relative odds ratio (ror) with large sample confidence interval","https://econpapers.repec.org/software/bocbocode/s459082.htm","`Niels Henrik Bruun`","R"
"ros","stata module for estimation of regression order statistics","https://econpapers.repec.org/software/bocbocode/s459174.htm","`Niels Henrik Bruun`","R"
"rosali","stata module to detect of response shift at item-level between two times of measurement","https://econpapers.repec.org/software/bocbocode/s458796.htm","`Myriam Blanchin`,` Priscilla Brisson`","R"
"rosner","stata module implementing rosner's generalized extreme studentized deviate (esd) procedure to detect multiple outliers","https://econpapers.repec.org/software/bocbocode/s459315.htm","`Ariel Linden`","R"
"rotate2","stata module to produce sorted and labeled rotated matrix","https://econpapers.repec.org/software/bocbocode/s458011.htm","`Daniel Klein`","R"
"rowmat_utils","stata module to perform parallel computation on sequences of matrices in mata","https://econpapers.repec.org/software/bocbocode/s457888.htm","`Matthew Baker`","R"
"rowranks","stata module to create row ranks of a set of variables","https://econpapers.repec.org/software/bocbocode/s414102.htm","`Nicholas Cox`","R"
"rowsort","stata module to row sort a set of integer variables","https://econpapers.repec.org/software/bocbocode/s415101.htm","`Nicholas Cox`","R"
"rowsum","stata module for summing up values of observations and saving results to a new observation","https://econpapers.repec.org/software/bocbocode/s459170.htm","`Pengzhan Qian`","R"
"rpaxioms","stata module to test and evaluate axioms of revealed preferences","https://econpapers.repec.org/software/bocbocode/s458800.htm","`Marcos Demetry`,` Per Hjertstrand`,` Matthew Polisson`","R"
"rpme","stata module to compute robust pareto midpoint estimator","https://econpapers.repec.org/software/bocbocode/s457962.htm","`Paul von Hippel`,` Daniel Powers`","R"
"rpnfcn","stata module to provide a mata generic function evaluator based on reverse polish notation","https://econpapers.repec.org/software/bocbocode/s456887.htm","`Henrik Stovring`","R"
"rq","rats module to generate regression quantile","https://econpapers.repec.org/software/bocbocode/r942001.htm","`Eric Blankmeyer`","R"
"rq","stata module to compute reynal-querol index of ethnic polarization","https://econpapers.repec.org/software/bocbocode/s457796.htm","`Carlos Grad`í`n`","R"
"rqr","stata module to estimate the residualized quantile regression model","https://econpapers.repec.org/software/bocbocode/s458999.htm","`Nicolai T`.` Borgen`,` Andreas Haupt`,` `Ø`yvind Wiborg`","R"
"rqrs","stata module to install required community-contributed packages","https://econpapers.repec.org/software/bocbocode/s458705.htm","`Daniel Klein`","R"
"rrcalc","stata module to calculate aapor compliant response rates","https://econpapers.repec.org/software/bocbocode/s458109.htm","`Kai Willem Weyandt`,` Lars Kaczmirek`","R"
"rrgqtest","rats procedure to compute a goldfeld-quandt test on recursive residuals","https://econpapers.repec.org/software/bocbocode/rts00190.htm","`Tom Doan`","R"
"rrlogit","stata module to estimate logistic regression for randomized response data","https://econpapers.repec.org/software/bocbocode/s456203.htm","`Ben Jann`","R"
"rrp","stata module to compute rescaled regression prediction (rrp) using two samples","https://econpapers.repec.org/software/bocbocode/s459111.htm","`Stavros Poupakis`","R"
"rrr","stata module to perform reduced rank regression","https://econpapers.repec.org/software/bocbocode/s458882.htm","`Bang Zheng`,` Canqing Yu`","R"
"rrreg","stata module to estimate linear probability model for randomized response data","https://econpapers.repec.org/software/bocbocode/s456962.htm","`Ben Jann`","R"
"rscore","stata module for estimation of responsiveness scores","https://econpapers.repec.org/software/bocbocode/s458078.htm","`Giovanni Cerulli`","R"
"rscript","stata module to call an r script from stata","https://econpapers.repec.org/software/bocbocode/s458644.htm","`David Molitor`,` Julian Reif`","R"
"rsens","stata module to perform sensitivity analysis after matching with multiple nearest neighbours","https://econpapers.repec.org/software/bocbocode/s458040.htm","`Sunil Mitra Kumar`","R"
"rsgt","stata module to generate skewed generalized t random numbers","https://econpapers.repec.org/software/bocbocode/s458221.htm","`Jake Orchard`","R"
"rsoort","stata module to perform oort's structural equations modeling (sem) based procedure to detect response shift","https://econpapers.repec.org/software/bocbocode/s457661.htm","`Jean`-`Benoit Hardouin`","R"
"rsort","stata module to perform reproducible random sorting of dataset","https://econpapers.repec.org/software/bocbocode/s457729.htm","`Phil Clayton`","R"
"rsource","stata module to run r from inside stata using an r source file","https://econpapers.repec.org/software/bocbocode/s456847.htm","`Roger Newson`","R"
"rspeedindex","stata module to compute a response speed index and perform outlier identification","https://econpapers.repec.org/software/bocbocode/s458007.htm","`Joss Ro`ß`mann`","R"
"rsstatistic","rats procedure to compute r/s statistic (classical or lo's modified)","https://econpapers.repec.org/software/bocbocode/rts00191.htm","`Tom Doan`","R"
"rsz","stata module to draw a stratified simple random sample, a systematic sample, or a randomly split zones sample, with probabilities proportional to size","https://econpapers.repec.org/software/bocbocode/s458302.htm","`Cong Ye`","R"
"rtfutil","stata module to provide utilities for writing rich text format (rtf) files","https://econpapers.repec.org/software/bocbocode/s457080.htm","`Roger Newson`","R"
"rtmci","stata module to estimate regression to the mean effects with confidence intervals","https://econpapers.repec.org/software/bocbocode/s457757.htm","`Ariel Linden`","R"
"rtnorm","stata mata module to produce truncated normal pseudorandom variates","https://econpapers.repec.org/software/bocbocode/s457139.htm","`Federico Belotti`,` Giuseppe Ilardi`","R"
"runby","stata module to run a user's program on by-groups of observations","https://econpapers.repec.org/software/bocbocode/s458413.htm","`Robert Picard`,` Clyde Schechter`","R"
"runmixregls","stata module to run the mixregls software from within stata","https://econpapers.repec.org/software/bocbocode/s457669.htm","`George Leckie`,` Chris Charlton`","R"
"runmlwin","stata module to run the mlwin multilevel modelling software from within stata","https://econpapers.repec.org/software/bocbocode/s457335.htm","`George Leckie`,` Chris Charlton`","R"
"runmplus","stata module to run mplus from stata","https://econpapers.repec.org/software/bocbocode/s457154.htm","`Rich Jones`","R"
"running","stata module for symmetric nearest neighbour smoothing","https://econpapers.repec.org/software/bocbocode/s457226.htm","`Peter Sasieni`,` Patrick Royston`,` Nicholas Cox`","R"
"runningprod","stata mata module to obtain the running product of a vector","https://econpapers.repec.org/software/bocbocode/s457140.htm","`Federico Belotti`,` Silvio Daidone`","R"
"runparscale","stata module to run parscale from stata","https://econpapers.repec.org/software/bocbocode/s456724.htm","`Laura Gibbons`","R"
"runtest","rats procedure to compute a run test for a two-state series","https://econpapers.repec.org/software/bocbocode/rts00192.htm","`Tom Doan`","R"
"russ_stata","stata tutorial in russian","https://econpapers.repec.org/software/bocbocode/s417006.htm","`Stanislav Kolenikov`","R"
"rwg","stata module to compute within group interrater reliability","https://econpapers.repec.org/software/bocbocode/s457510.htm","`Muhammad Rashid Ansari`","R"
"rwolf2","stata module to calculate romano-wolf stepdown p-values for multiple hypothesis testing","https://econpapers.repec.org/software/bocbocode/s458970.htm","`Damian Clarke`","R"
"rwolf","stata module to calculate romano-wolf stepdown p-values for multiple hypothesis testing","https://econpapers.repec.org/software/bocbocode/s458276.htm","`Damian Clarke`","R"
"rwrmed","stata module for performing causal mediation analysis using regression-with-residuals","https://econpapers.repec.org/software/bocbocode/s458801.htm","`Ariel Linden`,` Chuck Huber`,` Geoffrey T`.` Wodtke`","R"
"sadi","stata module to compute sequence analysis distance measures","https://econpapers.repec.org/software/bocbocode/s458056.htm","`Brendan Halpin`","S"
"sae","stata module to provide commands and mata functions devoted to unit level small area estimation","https://econpapers.repec.org/software/bocbocode/s458525.htm","`Minh Nguyen`,` Paul Corral Rodas`,` Jo`ã`o Pedro Azevedo`,` Qinghua Zhao`","S"
"safedrop","stata module to drop variables if and only if varnames specified in full","https://econpapers.repec.org/software/bocbocode/s435201.htm","`Nicholas Cox`","S"
"sampicc","stata module to compute sample size for an intra-class correlation (icc)","https://econpapers.repec.org/software/bocbocode/s456978.htm","`Paul F`.` Visintainer`","S"
"samplepps","stata module to draw a random sample with probabilities proportional to size","https://econpapers.repec.org/software/bocbocode/s454101.htm","`Stephen Jenkins`","S"
"samplesize","stata module to execute sampsi multiple times and produce a graph","https://econpapers.repec.org/software/bocbocode/s456412.htm","`Adrian Mander`","S"
"sampsi_fleming","stata module to compute exact sample size calculation for single-stage designs","https://econpapers.repec.org/software/bocbocode/s457055.htm","`Adrian Mander`","S"
"sampsi_gehan","stata module to give the parameters of the single stage gehan design","https://econpapers.repec.org/software/bocbocode/s458476.htm","`Adrian Mander`","S"
"sampsi_mcc","stata module to calculate sample size or power for matched case-control studies","https://econpapers.repec.org/software/bocbocode/s456423.htm","`Adrian Mander`","S"
"sampsi_reg","stata module to calculate the sample size/power for linear regression","https://econpapers.repec.org/software/bocbocode/s456418.htm","`Adrian Mander`","S"
"sampsi_rho","stata module to compute sample size for a pearson correlation","https://econpapers.repec.org/software/bocbocode/s456774.htm","`Adrian Mander`","S"
"sampsi_sccs","stata module to calculate the sample size for self controlled case series study designs","https://econpapers.repec.org/software/bocbocode/s457032.htm","`Philip Ryan`","S"
"sankey","stata module for sankey diagrams","https://econpapers.repec.org/software/bocbocode/s459154.htm","`Asjad Naqvi`","S"
"sankey_plot","stata module to produce sankey plots","https://econpapers.repec.org/software/bocbocode/s459067.htm","`Fernando Rios`-`Avila`","S"
"sankeyplot","stata module to produce sankey diagramms","https://econpapers.repec.org/software/bocbocode/s459089.htm","`Maik Hamjediers`","S"
"saswrapper","stata module to run a sas program from within stata","https://econpapers.repec.org/software/bocbocode/s457027.htm","`Dan Blanchette`","S"
"savas","c-shell script for *nix which makes stata versions of sas data files","https://econpapers.repec.org/software/bocbocode/s435500.htm","`Dan Blanchette`","S"
"savasas","stata module to save your dataset as a sas dataset","https://econpapers.repec.org/software/bocbocode/s435502.htm","`Dan Blanchette`","S"
"savastata","sas macro to save a sas dataset as a stata dataset","https://econpapers.repec.org/software/bocbocode/s435509.htm","`Dan Blanchette`","S"
"save12","stata module to save data in version 12 format","https://econpapers.repec.org/software/bocbocode/s458250.htm","`Michael Stepner`","S"
"save13","stata module to save data in version 13 format","https://econpapers.repec.org/software/bocbocode/s458252.htm","`Michael Stepner`","S"
"save9","stata module to save dataset in stata 9 format","https://econpapers.repec.org/software/bocbocode/s457269.htm","`Marco Ercolani`","S"
"saveascii","stata module to provide wrapper for saveold, incorporating translation of unicode characters to extended ascii encodings","https://econpapers.repec.org/software/bocbocode/s458053.htm","`Daniel Bela`","S"
"saveresults","stata module to save output from a command in a file on disk","https://econpapers.repec.org/software/bocbocode/s457089.htm","`Ben Jann`","S"
"savesome","stata module to save subset of data","https://econpapers.repec.org/software/bocbocode/s418401.htm","`Nicholas Cox`","S"
"savespss","stata module to save data to spss (.sav) system file","https://econpapers.repec.org/software/bocbocode/s457873.htm","`Sergiy Radyakin`","S"
"sbbq","stata module to implement the harding and pagan (2002) business cycle dating algorithm","https://econpapers.repec.org/software/bocbocode/s457288.htm","`Philippe Bracke`","S"
"sbldo","stata module to access stata do-files of songbl command","https://econpapers.repec.org/software/bocbocode/s458953.htm","`Song Bolin`","S"
"sblsf","stata module to easily browse and access the posts of the stata forum","https://econpapers.repec.org/software/bocbocode/s458974.htm","`Song Bolin`","S"
"sbmeff","stata module to estimate slack-based measure efficiency of decision-making units","https://econpapers.repec.org/software/bocbocode/s458707.htm","`Kerry Du`","S"
"sbplot5","stata module to generate scatter plot with one y variable shown by vertical bars","https://econpapers.repec.org/software/bocbocode/s369101.htm","`Nicholas Cox`","S"
"sbplot","stata module to generate scatter plot with one y variable shown by vertical bars","https://econpapers.repec.org/software/bocbocode/s369102.htm","`Nicholas Cox`","S"
"sbri","stata module to calculate the spearman-brown reliability","https://econpapers.repec.org/software/bocbocode/s456795.htm","`Nicola Orsini`","S"
"sbrowni","stata module to calculate spearman-brown reliability correction for test length","https://econpapers.repec.org/software/bocbocode/s351002.htm","`Herve M`.` Caci`","S"
"scale_transformation","stata module to find a 6th-degree monotonic polynomial transformation for a test score scale","https://econpapers.repec.org/software/bocbocode/s458659.htm","`Andres Yi Chang`","S"
"scandata","stata module to scan a dataset for specified characteristics","https://econpapers.repec.org/software/bocbocode/s458186.htm","`Malte Kaukal`","S"
"scat3","stata module for crude three-dimensional graphics","https://econpapers.repec.org/software/bocbocode/s445801.htm","`Nicholas Cox`","S"
"scatter3d","stata module to create 3d scatter plots for the web, using html5 3d feature and java api developped by canvasxpress","https://econpapers.repec.org/software/bocbocode/s457922.htm","`Thomas Roca`","S"
"scatterfit","stata module to produce scatter plots with fit lines","https://econpapers.repec.org/software/bocbocode/s459198.htm","`Leo Ahrens`","S"
"sccsdta","stata module to generate a dataset for the self-controlled case series method (sccs)","https://econpapers.repec.org/software/bocbocode/s459326.htm","`Niels Henrik Bruun`","S"
"scdensity","stata module to perform univariate self-consistent density estimation","https://econpapers.repec.org/software/bocbocode/s457486.htm","`Joerg Luedicke`","S"
"scenreg","stata module for estimating effects in models for binary variables given a scenario concerning unobserved variables","https://econpapers.repec.org/software/bocbocode/s457199.htm","`Maarten Buis`","S"
"scenttest","stata module to compute scenario arithmetic means and their difference","https://econpapers.repec.org/software/bocbocode/s457904.htm","`Roger Newson`","S"
"scfcombo","stata module to estimate errors using the survey of consumer finances","https://econpapers.repec.org/software/bocbocode/s458017.htm","`Karen Pence`","S"
"scheme-burd","stata module to provide a colorbrewer-inspired graphics scheme with qualitative and blue-to-red diverging colors","https://econpapers.repec.org/software/bocbocode/s457623.htm","`Fran`ç`ois Briatte`","S"
"scheme-mrc","stata module to provide graphics scheme for uk medical research council","https://econpapers.repec.org/software/bocbocode/s457703.htm","`Tim Morris`","S"
"scheme-tfl","stata module to provide graph scheme, based on transport for london's corporate colour pallette","https://econpapers.repec.org/software/bocbocode/s458103.htm","`Tim Morris`","S"
"scheme_rbn1mono","stata module to provide minimal monochrome graphics schemes","https://econpapers.repec.org/software/bocbocode/s456505.htm","`Roger Newson`","S"
"scheme_scientific","stata module to provide a graphic scheme favored by many scientific journals","https://econpapers.repec.org/software/bocbocode/s458518.htm","`Ariel Linden`","S"
"scheme_tufte","stata module to provide a tufte-inspired graphics scheme","https://econpapers.repec.org/software/bocbocode/s457285.htm","`Ulrich Atz`","S"
"scheme_ukri","stata module to provide graphics scheme for uk research and innovation (ukri) guidelines","https://econpapers.repec.org/software/bocbocode/s459168.htm","`Tim Morris`","S"
"schemepack","stata module providing ready-to-use graph schemes","https://econpapers.repec.org/software/bocbocode/s459012.htm","`Asjad Naqvi`","S"
"scls","stata module to perform symmetrically censored least squares","https://econpapers.repec.org/software/bocbocode/s457402.htm","`Jo`ã`o Santos Silva`","S"
"scm","stata module to process data for social cognitive mapping","https://econpapers.repec.org/software/bocbocode/s457446.htm","`Zachary Neal`","S"
"scorecontributions","ox function to enable differentiation of vector-valued functions","https://econpapers.repec.org/software/bocbocode/x981001.htm","`Michael Creel`","S"
"scoregof","stata module to perform score test of normality for probit and bivariate probit","https://econpapers.repec.org/software/bocbocode/s457465.htm","`Richard Chiburis`","S"
"scoregrp","stata module to perform a score test for equality of parameters across groups of observations","https://econpapers.repec.org/software/bocbocode/s457639.htm","`Paulo Guimaraes`","S"
"scores","stata module to creates scores (row-wise) of a set of variables allowing the specification of the number of valid values required and/or to produce various transformations of scores","https://econpapers.repec.org/software/bocbocode/s456915.htm","`Dirk Enzmann`","S"
"scrapeideas","matlab function to extract information from ideas","https://econpapers.repec.org/software/bocbocode/m430010.htm","`Richard Tol`","S"
"screen","stata module to quickly identify possible outliers based on the interquartile range, percentile or standard deviation","https://econpapers.repec.org/software/bocbocode/s458348.htm","`Marco Santacroce`","S"
"scsomersd","stata module to compute rank statistics for scenario comparisons","https://econpapers.repec.org/software/bocbocode/s457197.htm","`Roger Newson`","S"
"scto","stata module to provide utility functions for data collected using surveycto","https://econpapers.repec.org/software/bocbocode/s458604.htm","`SurveyCTO`","S"
"sctree","stata module to implement classification trees via optimal pruning, bagging, random forests, and boosting methods","https://econpapers.repec.org/software/bocbocode/s458645.htm","`Giovanni Cerulli`","S"
"scul","stata module to implement regularized synthetic control (using lasso) estimators for single and multiple-treated unit settings","https://econpapers.repec.org/software/bocbocode/s459107.htm","`Jared Greathouse`","S"
"sdecode","stata module to decode a numeric variable into a string variable","https://econpapers.repec.org/software/bocbocode/s417702.htm","`Roger Newson`","S"
"sdid","stata module to perform synthetic difference-in-differences estimation, inference, and visualization","https://econpapers.repec.org/software/bocbocode/s459058.htm","`Daniel Paila`ñ`ir`,` Damian Clarke`,` Diego Ciccia`","S"
"sdid_event","stata module providing synthetic difference-in-differences (sdid) event-study estimators","https://econpapers.repec.org/software/bocbocode/s459354.htm","`Diego Ciccia`,` Damian Clarke`,` Daniel Paila`ñ`ir`","S"
"sdist","stata module to simulate the central limit theorem","https://econpapers.repec.org/software/bocbocode/s458307.htm","`Marshall Taylor`","S"
"sdlim","stata module to rescale variables measured with a limited rating scale","https://econpapers.repec.org/software/bocbocode/s457182.htm","`Ulrich Kohler`","S"
"sdline","stata module to plot sd line or reduced major axis","https://econpapers.repec.org/software/bocbocode/s456759.htm","`Nicholas Cox`","S"
