"cmdName","Description","Link","Authors","Letter"
"mstdize","stata module to produce marginal standardization of two-way tables","https://econpapers.repec.org/software/bocbocode/s347501.htm","`Nicholas Cox`","M"
"mstore","stata module to store and retrieve matrices with dataset","https://econpapers.repec.org/software/bocbocode/s418302.htm","`Michael Blasnik`","M"
"msvarsetup","rats procedure to perform markov switching var setup procedures","https://econpapers.repec.org/software/bocbocode/rts00137.htm","`Tom Doan`","M"
"mswtable","stata module to provide wrapper for putdocx table","https://econpapers.repec.org/software/bocbocode/s459338.htm","`John Casterline`","M"
"mtab","stata module to store results in a matrix","https://econpapers.repec.org/software/bocbocode/s458858.htm","`Chunsen Wu`","M"
"mtad","stata module to perform multinomial test of agglomeration and dispersion","https://econpapers.repec.org/software/bocbocode/s457205.htm","`Timothy Simcoe`","M"
"mtebinary","stata module to compute marginal treatment effects (mte) with a binary instrument","https://econpapers.repec.org/software/bocbocode/s458285.htm","`Amanda Kowalski`,` Yen Tran`,` Ljubica Ristovska`","M"
"mtefe","stata module to compute marginal treatment effects with factor variables","https://econpapers.repec.org/software/bocbocode/s458654.htm","`Martin Andresen`","M"
"mtemore","stata module to compute marginal treatment effects (mte) with a binary instrument","https://econpapers.repec.org/software/bocbocode/s458503.htm","`Amanda Kowalski`,` Yen Tran`,` Ljubica Ristovska`","M"
"mtpi","stata module for the modified toxicity probability interval design","https://econpapers.repec.org/software/bocbocode/s458812.htm","`Adrian Mander`","M"
"mtreatreg","stata module to fits models with multinomial treatments and continuous, count and binary outcomes using maximum simulated likelihood","https://econpapers.repec.org/software/bocbocode/s457064.htm","`Partha Deb`","M"
"mulogit","stata module to calculate multivariate and univariate odds ratios in logistic regression","https://econpapers.repec.org/software/bocbocode/s456921.htm","`Leif E`.` Peterson`","M"
"multencode","stata module to encode multiple string variables into numeric","https://econpapers.repec.org/software/bocbocode/s456993.htm","`Nicholas Cox`","M"
"multibar","stata module to produce bar and dot graphs for use with overlapping over() categories","https://econpapers.repec.org/software/bocbocode/s456857.htm","`Fred Wolfe`","M"
"multicoefplot","stata module to produce advanced repeated cross-section graphical analysis","https://econpapers.repec.org/software/bocbocode/s458942.htm","`Matteo Pinna`","M"
"multidensity","stata module for kernel density estimation for many variables or groups","https://econpapers.repec.org/software/bocbocode/s458810.htm","`Nicholas Cox`","M"
"multidot","stata module for multiple panel dot charts and similar","https://econpapers.repec.org/software/bocbocode/s458376.htm","`Nicholas Cox`","M"
"multif","stata module to construct multiple if-restrictions with the same value for different variables","https://econpapers.repec.org/software/bocbocode/s458520.htm","`Sven`-`Kristjan Bormann`","M"
"multiline","stata module for multiple panel line plots","https://econpapers.repec.org/software/bocbocode/s458369.htm","`Nicholas Cox`","M"
"multimport","stata module to import multiple non-stata datafiles into memory, appending them automatically","https://econpapers.repec.org/software/bocbocode/s458470.htm","`Alvaro Carril`","M"
"multipc2d","rats module for cointegration tests in heterogenous panels with multiple regressors","https://econpapers.repec.org/software/bocbocode/r210402.htm","`Peter Pedroni`","M"
"multiplebreaks","rats procedure to perform multiple structural change analysis","https://econpapers.repec.org/software/bocbocode/rts00138.htm","`Tom Doan`","M"
"multipurt","stata module to run 1st and 2nd generation panel unit root tests for multiple variables and lags","https://econpapers.repec.org/software/bocbocode/s457239.htm","`Markus Eberhardt`","M"
"multishell","stata module to allot do files and variations of loops across parallel instances of windows stata and computers efficiently","https://econpapers.repec.org/software/bocbocode/s458512.htm","`Jan Ditzen`","M"
"multistate","stata module to perform multi-state survival analysis","https://econpapers.repec.org/software/bocbocode/s458207.htm","`Michael J`.` Crowther`,` Paul Lambert`","M"
"multivrs","stata module to conduct multiverse analysis","https://econpapers.repec.org/software/bocbocode/s458927.htm","`Cristobal Young`,` Katherine Holsteen`","M"
"multnorm","rats module to generate a sample from a multivariate normal population","https://econpapers.repec.org/software/bocbocode/r940501.htm","`Eric Blankmeyer`","M"
"mundlak","stata module to estimate random-effects regressions adding group-means of independent variables to the model","https://econpapers.repec.org/software/bocbocode/s457601.htm","`Francisco `(`Paco`)` Perales`","M"
"muxplot","stata module to produce scatter plots with y versus multiple x variables","https://econpapers.repec.org/software/bocbocode/s362302.htm","`Nicholas Cox`","M"
"muxyplot","stata module to produce scatter plots with multiple x and y variables","https://econpapers.repec.org/software/bocbocode/s362301.htm","`Nicholas Cox`","M"
"mv-ar","gauss module to calculate three multivariate tests for autocorrelation in var model","https://econpapers.repec.org/software/bocbocode/g00011.htm","`R Scott Hacker`,` Abdulnasser Hatemi`-`J`","M"
"mv-arch","gauss module to implement the multivariate arch test","https://econpapers.repec.org/software/bocbocode/g00009.htm","`R Scott Hacker`,` Abdulnasser Hatemi`-`J`","M"
"mvarchtest","rats procedure to perform multivariate test for arch","https://econpapers.repec.org/software/bocbocode/rts00139.htm","`Tom Doan`","M"
"mvbndecomp","rats procedure to compute a multivariate beveridge-nelson decomposition via var's","https://econpapers.repec.org/software/bocbocode/rts00140.htm","`Tom Doan`","M"
"mvcorr","stata module to generate moving-window correlation or autocorrelation in time series or panel","https://econpapers.repec.org/software/bocbocode/s438801.htm","`Nicholas Cox`,` Christopher Baum`","M"
"mvdcmp","stata module to compute multivariate decomposition for nonlinear response models","https://econpapers.repec.org/software/bocbocode/s458968.htm","`Daniel Powers`,` Hirotoshi Yoshioka`,` Myeong`-`Su Yun`","M"
"mvfiles","stata module to provide a convenient way to move/copy matched files from a specified input directory (also including, if wanted, additionally recursively matched subsets of files within distinctly matched offspring-directories) to a specified output directory","https://econpapers.repec.org/software/bocbocode/s457628.htm","`Lars Angquist`","M"
"mvfilter","stata module to compute multivariate time-series filter","https://econpapers.repec.org/software/bocbocode/s459295.htm","`Gregorio Impavido`","M"
"mvgarchfore","rats procedure to perform multivariate garch forecasting","https://econpapers.repec.org/software/bocbocode/rts00141.htm","`Tom Doan`","M"
"mvgarchtovech","rats procedure to extract a vech representation from garch estimates","https://econpapers.repec.org/software/bocbocode/rts00245.htm","`Tom Doan`","M"
"mvident","rats procedure to create a tiao-box cross correlation matrix","https://econpapers.repec.org/software/bocbocode/rts00142.htm","`Tom Doan`","M"
"mvjb","rats procedure to perform multivariate jarque-bera normality test","https://econpapers.repec.org/software/bocbocode/rts00143.htm","`Tom Doan`","M"
"mvmeta","stata module to perform multivariate random-effects meta-analysis","https://econpapers.repec.org/software/bocbocode/s456970.htm","`Ian White`","M"
"mvnxpb","stata module for computation of multivariate normal probabilities using bivariate conditioning","https://econpapers.repec.org/software/bocbocode/s458493.htm","`Svetlana Mladenovic`,` Federico Belotti`","M"
"mvport","stata module for collection, optimization and backtest of financial portfolios","https://econpapers.repec.org/software/bocbocode/s457712.htm","`Carlos Dorantes`","M"
"mvprobit","stata module to calculate multivariate probit regression using simulated maximum likelihood","https://econpapers.repec.org/software/bocbocode/s432601.htm","`Lorenzo Cappellari`,` Stephen Jenkins`","M"
"mvqstat","rats procedure to compute hosking's multivariate q statistic","https://econpapers.repec.org/software/bocbocode/rts00145.htm","`Tom Doan`","M"
"mvsamp1i","stata module to determine sample size and power for multivariate regression","https://econpapers.repec.org/software/bocbocode/s345801.htm","`David E`.` Moore`","M"
"mvsampsi","stata module to determine sample size and power for multivariate regression","https://econpapers.repec.org/software/bocbocode/s345802.htm","`David E`.` Moore`","M"
"mvsktest","stata module to test for multivariate skewness and kurtosis","https://econpapers.repec.org/software/bocbocode/s456701.htm","`Stanislav Kolenikov`","M"
"mvsumm","stata module to generate moving-window descriptive statistics in time series or panel","https://econpapers.repec.org/software/bocbocode/s426401.htm","`Nicholas Cox`,` Christopher Baum`","M"
"mvtest","stata module to perform multivariate f tests","https://econpapers.repec.org/software/bocbocode/s345804.htm","`David E`.` Moore`","M"
"mvtnorm","stata module to work with the multivariate normal and multivariate t distributions, with and without variable truncation","https://econpapers.repec.org/software/bocbocode/s458043.htm","`Michael Grayling`,` Adrian Mander`","M"
"mvtobit","stata module to calculate multivariate tobit models by simulated maximum likelihood (sml)","https://econpapers.repec.org/software/bocbocode/s456875.htm","`Mikkel Barslund`","M"
"myaxis","stata module to reorder categorical variable by specified sort criterion","https://econpapers.repec.org/software/bocbocode/s458924.htm","`Nicholas Cox`","M"
"mycd10","stata module to process icd-10 diagnosis and procedure codes","https://econpapers.repec.org/software/bocbocode/s457843.htm","`Joe Canner`","M"
"mycolours","stata module for setting a palette of colours through local macros","https://econpapers.repec.org/software/bocbocode/s458826.htm","`Nicholas Cox`","M"
"mydatelabels","stata module to generate axis labels with a label every time a component changes","https://econpapers.repec.org/software/bocbocode/s458417.htm","`Brent McSharry`","M"
"mylabels","stata module for axis labels or ticks on transformed scales or for daily dates","https://econpapers.repec.org/software/bocbocode/s432201.htm","`Nicholas Cox`,` Scott Merryman`","M"
"mypkg","stata module to inform on packages installed over net","https://econpapers.repec.org/software/bocbocode/s431001.htm","`Nicholas Cox`","M"
"myweeks","stata module for generating numbered weeks from daily date variables","https://econpapers.repec.org/software/bocbocode/s459340.htm","`Nicholas Cox`","M"
"nb_adjust","stata module to identify and adjust outliers of a variable assumed to follow a negative binomial distribution","https://econpapers.repec.org/software/bocbocode/s458051.htm","`Dirk Enzmann`","N"
"nbercycles","rats procedure to generate dummies based upon nber cycle dates","https://econpapers.repec.org/software/bocbocode/rts00146.htm","`Tom Doan`","N"
"nbercycles","stata module to generate graph command (and optionally graph) timeseries vs. nber recession dating","https://econpapers.repec.org/software/bocbocode/s456746.htm","`Christopher Baum`","N"
"nbfit","stata module for fitting negative binomial distribution by maximum likelihood","https://econpapers.repec.org/software/bocbocode/s424001.htm","`Nicholas Cox`,` Roberto G`.` Gutierrez`","N"
"nbinreg","stata module to estimate negative binomial regression models","https://econpapers.repec.org/software/bocbocode/s333901.htm","`Joseph Hilbe`","N"
"nbstrat","stata module to estimate negative binomial with endogenous stratification","https://econpapers.repec.org/software/bocbocode/s456414.htm","`Joseph Hilbe`,` Roberto Martinez`-`Espineira`","N"
"nca","stata module to perform necessary condition analysis (nca)","https://econpapers.repec.org/software/bocbocode/s459269.htm","`Daniele Spinelli`,` Jan Dul`","N"
"ncf","stata modules related to the noncentral f distribution","https://econpapers.repec.org/software/bocbocode/s411902.htm","`Thomas Steichen`","N"
"nct","stata modules related to the noncentral t distribution","https://econpapers.repec.org/software/bocbocode/s411901.htm","`Thomas Steichen`","N"
"ndbci","stata module extending ci for single variable with exposure time","https://econpapers.repec.org/software/bocbocode/s445401.htm","`Fred Wolfe`","N"
"nearest","stata module to calculate nearest neighbours from point coordinates","https://econpapers.repec.org/software/bocbocode/s430601.htm","`Nicholas Cox`","N"
"nearmrg","stata module to provide nearest-match merging of datasets","https://econpapers.repec.org/software/bocbocode/s434901.htm","`Eric Booth`","N"
"nearstat","stata module to calculate distance-based variables and export distance matrix to text file","https://econpapers.repec.org/software/bocbocode/s457110.htm","`P`.` Wilner Jeanty`","N"
"nehurdle","stata module for estimation of models with corner solutions","https://econpapers.repec.org/software/bocbocode/s458609.htm","`Alfonso S`á`nchez`-`Pe`ñ`alver`","N"
"neoclassical","stata module to estimate neoclassical education transitions model","https://econpapers.repec.org/software/bocbocode/s457295.htm","`Samuel R`.` Lucas`","N"
"netplot","stata module to provide social network visualization","https://econpapers.repec.org/software/bocbocode/s457142.htm","`Rense Corten`","N"
"netreg","stata module to perform linear regression of a network response with the exchangeable assumption","https://econpapers.repec.org/software/bocbocode/s458521.htm","`Dayou Luo`","N"
"network","stata module to perform network meta-analysis","https://econpapers.repec.org/software/bocbocode/s458319.htm","`Ian White`","N"
"newey2","stata module to extend newey (hac covariance estimation)","https://econpapers.repec.org/software/bocbocode/s428901.htm","`David Roodman`","N"
"newsimpact","stata module to compute news impact curve for arch models","https://econpapers.repec.org/software/bocbocode/s456925.htm","`Sune Karlsson`","N"
"next","stata module to perform regression discontinuity","https://econpapers.repec.org/software/bocbocode/s458238.htm","`Mark Long`,` Jordan Rooklyn`","N"
"ngram","stata module to provide n-gram feature extractor","https://econpapers.repec.org/software/bocbocode/s458553.htm","`Matthias Schonlau`","N"
"nharvey","stata module to perform nyblom-harvey panel test of common stochastic trends","https://econpapers.repec.org/software/bocbocode/s419703.htm","`Christopher Baum`,` Fabian Bornhorst`","N"
"nicedates","stata module for nice dates, especially for time series graphs","https://econpapers.repec.org/software/bocbocode/s434502.htm","`Nicholas Cox`","N"
"niceest","stata module to export regression table to excel","https://econpapers.repec.org/software/bocbocode/s458531.htm","`Mark Soe`,` Henrik Stovring`","N"
"nicelabels","stata module for nice axis labels for general scales","https://econpapers.repec.org/software/bocbocode/s459077.htm","`Nicholas Cox`","N"
"niceloglabels","stata module to produce nice axis labels for logarithmic scales","https://econpapers.repec.org/software/bocbocode/s458416.htm","`Nicholas Cox`","N"
"nicewords","stata module to pay compliments","https://econpapers.repec.org/software/bocbocode/s458570.htm","`Joe Long`","N"
"njc_stuff","stata module documenting stata programs and help files by nicholas j. cox","https://econpapers.repec.org/software/bocbocode/s456852.htm","`Nicholas Cox`","N"
"nlcheck","stata module to check linearity assumption after model estimation","https://econpapers.repec.org/software/bocbocode/s456968.htm","`Ben Jann`","N"
"nlcorr","stata module to compute correlation metric for cross-sample comparisons using non-linear probability models","https://econpapers.repec.org/software/bocbocode/s457289.htm","`Ulrich Kohler`,` Kristian Karlson`","N"
"nlecdyn_toolkit","matlab modules for analyzing nonlinear economic dynamic models easily","https://econpapers.repec.org/software/bocbocode/m428001.htm","`Harald Uhlig`","N"
"nmf","stata module to perform matrix decomposition using non-negative matrix factorization (nmf)","https://econpapers.repec.org/software/bocbocode/s459371.htm","`Jonathan Batty`","N"
"nmissing","stata module to show numbers of missing or present values","https://econpapers.repec.org/software/bocbocode/s455901.htm","`Nicholas Cox`","N"
"nnest","stata module to perform j test and cox-pesaran-deaton test for nonnested models","https://econpapers.repec.org/software/bocbocode/s352502.htm","`Gregorio Impavido`","N"
"nnipolate","stata module for nearest neighbour interpolation","https://econpapers.repec.org/software/bocbocode/s457545.htm","`Nicholas Cox`","N"
"nnls","stata module to compute non-negative least squares","https://econpapers.repec.org/software/bocbocode/s459325.htm","`Giovanni Cerulli`","N"
"nnmatch","stata module to compute nearest-neighbor bias-corrected estimators","https://econpapers.repec.org/software/bocbocode/s439701.htm","`Alberto Abadie`,` Jane Leber Herr`,` Guido Imbens`,` David Drukker`","N"
"nonadd","stata program to perform tukey test for non-additivity","https://econpapers.repec.org/software/bocbocode/uclanonadd.htm","`Philip B`.` Ender`","N"
"nonlintst","matlab function to perform nonlinearity tests for univariate time series","https://econpapers.repec.org/software/bocbocode/t741515.htm","`Shapour Mohammadi`","N"
"nonlintstmltvar","matlab function to perform nonlinearity tests for multivariate time series","https://econpapers.repec.org/software/bocbocode/t741516.htm","`Shapour Mohammadi`","N"
"nonparamreg","matlab function to estimate nonparametric regression","https://econpapers.repec.org/software/bocbocode/t741501.htm","`Shapour Mohammadi`","N"
"nonparaunitroot","shazam routine to perform the non-parametric unit root test statistic developed by breitung j.& gourieroux c.,(1997), journal of econometrics, vol.81(1), pp.7-27","https://econpapers.repec.org/software/bocbocode/shz00001.htm","`Ibrahim Onour`","N"
"nonparmde","stata module to calculate the minimum detectable effect in randomized experiment","https://econpapers.repec.org/software/bocbocode/s457566.htm","`Joel Middleton`,` John Ternovski`","N"
"nopo","stata module to perform nopo (2008) matching decompositions","https://econpapers.repec.org/software/bocbocode/s459289.htm","`Maximilian Sprengholz`,` Maik Hamjediers`","N"
"nopomatch","stata module to implement nopo's decomposition","https://econpapers.repec.org/software/bocbocode/s457157.htm","`Juan Pablo Atal`,` Alejandro Hoyos Suarez`,` Hugo `Ñ`opo`","N"
"norm","stata module to normalize variables","https://econpapers.repec.org/software/bocbocode/s457698.htm","`Muhammad Rashid Ansari`,` Chiara Mussida`","N"
"norm_dist","stata module providing normal and inverse normal distribution functions with added mean and standard deviation","https://econpapers.repec.org/software/bocbocode/s459274.htm","`Ariel Linden`","N"
"normalbvr","stata module to generate normal bivariate ridits","https://econpapers.repec.org/software/bocbocode/s458472.htm","`Roger Newson`","N"
"normalizepath","stata module to parse (and normalize) files' paths","https://econpapers.repec.org/software/bocbocode/s457619.htm","`George Vega`","N"
"normalrir","stata module to calculate ridits of inverse ridits between normal populations","https://econpapers.repec.org/software/bocbocode/s458340.htm","`Roger Newson`","N"
"normtest","stata module to perform tests of univariate kurtosis and skewness","https://econpapers.repec.org/software/bocbocode/s413101.htm","`Herve M`.` Caci`","N"
"npeivreg","stata module for estimation of nonparametric errors-in-variables (eiv) regression and construction of its uniform confidence band","https://econpapers.repec.org/software/bocbocode/s458791.htm","`Kengo Kato`,` Yuya Sasaki`","N"
"npinfo","stata module to merge network-based nodal characteristics","https://econpapers.repec.org/software/bocbocode/s457852a.htm","`Sebastian Pink`,` Sabrina Vogel`","N"
"npiv","stata module to perform nonparametric instrumental-variable regression on a scalar endogenous regressor","https://econpapers.repec.org/software/bocbocode/s458626.htm","`Denis Chetverikov`,` Dongwoo Kim`,` Daniel Wilhelm`","N"
"nproc","stata module to produce nonparametric receiver operating curves","https://econpapers.repec.org/software/bocbocode/s355602.htm","`Philip Price`,` Fred Wolfe`","N"
"npseries","stata module to perform nonparametric power series estimation","https://econpapers.repec.org/software/bocbocode/s457830.htm","`Boris Kaiser`","N"
"npss","stata module to estimate nonparametric heteroskedastic state space models","https://econpapers.repec.org/software/bocbocode/s458772.htm","`Irene Botosaru`,` Yuya Sasaki`","N"
"npsynth","stata module to implement nonparametric synthetic control method","https://econpapers.repec.org/software/bocbocode/s458398.htm","`Giovanni Cerulli`","N"
"nrow","stata module to rename variables as their nth-row values","https://econpapers.repec.org/software/bocbocode/s458116.htm","`Alvaro Carril`","N"
"nruns","stata module to compute number of runs compared with random shuffles","https://econpapers.repec.org/software/bocbocode/s456772.htm","`Nicholas Cox`,` Nigel Smeeton`","N"
"nscale","stata module to scale data","https://econpapers.repec.org/software/bocbocode/s458675.htm","`JeongHoon Min`","N"
"nsplit","stata module to split numeric variable into components","https://econpapers.repec.org/software/bocbocode/s447901.htm","`Dan Blanchette`","N"
"nstage","stata module for multi-arm, multi-stage (mams) trial designs for time-to-event outcomes","https://econpapers.repec.org/software/bocbocode/s457931.htm","`Patrick Royston`,` Daniel Bratton`,` Babak Choodari`-`Oskooei`,` Frederike Maria`-`Sophie Barthel`","N"
"nstagebin","stata module to provide facilities for optimising and designing multi-arm multi-stage (mams) randomised controlled trials with binary outcomes","https://econpapers.repec.org/software/bocbocode/s459248.htm","`Babak Choodari`-`Oskooei`,` Daniel J`.` Bratton`,` Mahesh KB Parmar`","N"
"nstagebinopt","stata module to compute admissible multi-arm multi-stage trial designs with binary outcomes","https://econpapers.repec.org/software/bocbocode/s457912.htm","`Daniel Bratton`","N"
"ntreatreg","stata module for estimation of treatment effects in the presence of neighbourhood interactions","https://econpapers.repec.org/software/bocbocode/s457961.htm","`Giovanni Cerulli`","N"
"num2base26","stata module to provide an interface to mata's numtobase26() function","https://econpapers.repec.org/software/bocbocode/s458505.htm","`Sven`-`Kristjan Bormann`","N"
"num2words","stata module to convert numbers to text","https://econpapers.repec.org/software/bocbocode/s457273.htm","`Eric Booth`","N"
"number_exporting","stata module to format a numeric value and export in latex format","https://econpapers.repec.org/software/bocbocode/s459344.htm","`Olena Bogdan`,` Adrien Matray`,` Pablo E`.` Rodriguez`,` Chenzi Xu`","N"
"numdate","stata module to generate date-times or components","https://econpapers.repec.org/software/bocbocode/s458057.htm","`Nicholas Cox`","N"
"nw_fromlist","stata module to build a network from a list of long-form data","https://econpapers.repec.org/software/bocbocode/s458359.htm","`Charlie Joyez`","N"
"nw_projection","stata module to project a bipartite network into one of its two dimensions","https://econpapers.repec.org/software/bocbocode/s458756.htm","`Charlie Joyez`","N"
"nw_wcc","stata module to calculate weighted clustering coefficients (wcc) in complex direct networks","https://econpapers.repec.org/software/bocbocode/s458305.htm","`Charlie Joyez`","N"
"nwannd","stata module to compute annd (average nearest neighbor degree) and related measures","https://econpapers.repec.org/software/bocbocode/s458261.htm","`Charlie Joyez`","N"
"nwassortativity","stata module to compute network assortativity coefficient","https://econpapers.repec.org/software/bocbocode/s459113.htm","`Charlie Joyez`","N"
"nwcluster","stata module to compute the clustering coefficient of a network's vertices","https://econpapers.repec.org/software/bocbocode/s458280.htm","`Charlie Joyez`","N"
"nwdisparity","stata module to calculate the disparity of a network's nodes","https://econpapers.repec.org/software/bocbocode/s458262.htm","`Charlie Joyez`","N"
"nwind","stata module to compute newey-windmeijer vce after ivreg2 gmm-cue estimation","https://econpapers.repec.org/software/bocbocode/s457780.htm","`Helmut Farbmacher`","N"
"nwreciprocity","stata module to calculate reciprocity metrics for (weighted) directed networks","https://econpapers.repec.org/software/bocbocode/s458263.htm","`Charlie Joyez`","N"
"nwstrengthcent","stata module to compute freeman's centrality index (1979) for strength centrality","https://econpapers.repec.org/software/bocbocode/s458281.htm","`Charlie Joyez`","N"
"nysiis","stata module to calculate nysiis codes from string variables","https://econpapers.repec.org/software/bocbocode/s457936.htm","`Adrian Sayers`","N"
"nytimes","stata module to display top news stories from the new york times","https://econpapers.repec.org/software/bocbocode/s457308.htm","`Neal Caren`","N"
"oaxaca8","stata module to compute decompositions of outcome differentials","https://econpapers.repec.org/software/bocbocode/s450604.htm","`Ben Jann`","O"
"oaxaca9","stata module to compute the blinder-oaxaca decomposition","https://econpapers.repec.org/software/bocbocode/s457102.htm","`Ben Jann`","O"
